Year,Sources,Name,Authors,First Author,Chinese/English,Abstract,Venues,doi
2020,IEEE Transactions on Wireless Communications,AUV-aided localization of underwater acoustic devices based on Doppler shift measurements,"Zijun Gong, Cheng Li, Fan Jiang, Jun Zheng",Zijun Gong,English,"The autonomous underwater vehicle(AUV)-aided localization techniques for underwater acoustic devices show promising applications in many scenarios, and most researches in this area are based on the time of arrival (ToA) or the time difference of arrival (TDoA) measurements. However, these measurements are not readily available. To develop a more universally applicable scheme, we investigate the possibility of employing the Doppler shift measurements for underwater localization of acoustic devices in this paper. To be specific, we employ a low-complexity algorithm for Doppler estimation, and prove that the estimation error can be well approximated by zero-mean Gaussian distribution. Based on the Doppler estimates, we can obtain a series of nonlinear equations. To solve them, we propose a two-phase linear algorithm to obtain high-accuracy position information of the target devices. Compared with the …",Article,https://ieeexplore.ieee.org/abstract/document/8952880/
2021,IEEE Transactions on Vehicular Technology,An adaptive asynchronous wake-up scheme for underwater acoustic sensor networks using deep reinforcement learning,"Ruoyu Su, Zijun Gong, Dengyin Zhang, Cheng Li, Yuanzhu Chen, Ramachandran Venkatesan",Ruoyu Su,English,"Underwater acoustic sensor networks (UWSNs), acting as a reliable and efficient infrastructure of the Internet of underwater things (IoUT), have attracted much research interest in recent years due to the wide range of their potential marine applications. The limited energy supply of underwater sensor nodes is a significant challenge that can be mitigated by the cyclic difference set (CDS)-based coordination asynchronous wake-up scheme. However, the CDS-based asynchronous wake-up scheme also introduces long delays in the neighbor discovery that deteriorates packet delay as well as the network lifetime. In this paper, we formulate the problem of policy selection for idle listening as a Markov decision process and exploit the framework of deep reinforcement learning to obtain the optimal policies of underwater sensor nodes. Furthermore, the long short-term memory (LSTM) networks are utilized to estimate the …",Article,https://ieeexplore.ieee.org/abstract/document/9337228/
2020,IEEE Transactions on Vehicular Technology,A machine learning-based approach for auto-detection and localization of targets in underwater acoustic array networks,"Zijun Gong, Cheng Li, Fan Jiang",Zijun Gong,English,"The localization and tracking of underwater objects have many applications. In a proactive underwater sensor array, some nodes will periodically broadcast linear frequency modulated (LFM) signals, which will hit the targets, get reflected and received by the other nodes. Depending on the target's position and velocity, the received signals will also be LFM signals of different frequencies and frequency rates. We can use the Fractional Fourier Transform (FrFT) to analyze the received signal's spectrum and find the peak. Based on the location of the peak, the target's distance and radial velocity can be estimated. However, the accuracy is highly dependent on the sampling interval of the spectrum. Smaller sampling interval leads to higher accuracy but also induces considerable complexity. To overcome this issue, we propose a machine learning-based approach to automatically detect the existence of the target, and …",Article,https://ieeexplore.ieee.org/abstract/document/9250694/
2020,IEEE Transactions on Wireless Communications,Data-aided Doppler compensation for high-speed railway communications over mmWave bands,"Zijun Gong, Cheng Li, Fan Jiang, Moe Z Win",Zijun Gong,English,"Millimeter wave communications show great potentials in many applications, one of which is the high-speed railway(HSR) communication system. However, a major challenge is the Doppler effect caused by the relative-movement between the train and the base station (BS), which leads to fast channel variation. To compensate for the Doppler shift, an accurate channel model is indispensable, and the far-field channel model is generally employed, which assumes that the dimensions of the antenna arrays are negligible compared to the distance between transmitter and receiver. This model is widely used in Cellular systems, but the underlining assumption is not always true for railway communication systems. In this paper, the modeling of the Doppler effect for millimeter wave in HSR communications is conducted, and data-aided Doppler estimation and compensation algorithms are designed based on the new …",Article,https://ieeexplore.ieee.org/abstract/document/9210206/
2020,Mobile Networks and Applications 25,An enhanced AUV-aided TDoA localization algorithm for underwater acoustic sensor networks,"Kun Hao, Kaicheng Yu, Zijun Gong, Xiujuan Du, Yonglei Liu, Lu Zhao",Kun Hao,English," Since localization now has been an essential step in underwater work. The traditional localization algorithm, like time different of arrival (TDoA) has been proposed for its efficiency in terrestrial while it cannot perform perfect because of the unstable propagation in the harsh underwater environment. And autonomous underwater vehicle (AUV) has been used in many circumstances to meet the needs of underwater works. Hence, an enhanced AUV-aided TDoA localization algorithm (EATLA) for underwater acoustic sensor networks (UASNs) is proposed. The AUV dives into the predefined depth from the water surface after acquiring its position coordinates through the GPS, and periodically transmits data packets around the unknown node. After the unknown node receives the data packets and calculates its position, the conditions for the unique result and evaluate the reliability are quantified. Then, to save the …",Article,https://link.springer.com/article/10.1007/s11036-020-01577-5
2020,IEEE Wireless Communications Letters,Analysis of the underwater multi-path reflections on Doppler shift estimation,"Zijun Gong, Cheng Li, Fan Jiang",Zijun Gong,English,"For underwater target localization and tracking, accurate Doppler shift estimation is very important. In this letter, the analysis of the multi-path effect on Doppler shift estimation accuracy is conducted for the narrow-band acoustic underwater channels. We conducted comprehensive analysis on the performance of a widely used low-complexity Doppler estimation algorithm, and showed that the mean square estimation error decreases with sample length quadratically. Then we derived the Cramér-Rao lower bound, which also decreases quadratically with sample length. As a result, we concluded that the impact of multi-path effect is negligible for a sampling length of several seconds. The theoretical results are verified by numerical simulations.",Article,https://ieeexplore.ieee.org/abstract/document/9121300/
2022,IEEE Transactions on Vehicular Technology,Algorithm design and performance analysis of target localization using mobile underwater acoustic array networks,"Ruoyu Su, Zijun Gong, Cheng Li, Xuemin Shen",Ruoyu Su,English,"Space-air-ground-sea integrated network, as a promising networking paradigm for the sixth generation (6 G) communications, connects satellite networks, aerial networks, terrestrial networks, and marine networks. As a fundamental application of marine networks, efficient target localization in the ocean is significant for many marine and underwater applications, including oceanic environmental monitoring, subsea resource exploration, and navigation safety. In this paper, to bring more scalability and feasibility of underwater localization, a mobile underwater acoustic array network is utilized to locate underwater moving targets by leveraging linear frequency modulated (LFM) signals. In the mobile underwater acoustic network, one node is constantly broadcasting LFM signals. Based on the reflected signals received by other nodes, a method that jointly utilizes the propagation delay and the Doppler effect is …",Article,https://ieeexplore.ieee.org/abstract/document/9910421/
2022,IEEE Transactions on Communications,Efficient channel estimation for wideband millimeter wave massive MIMO systems with beam squint,"Yuhui Song, Zijun Gong, Yuanzhu Chen, Cheng Li",Yuhui Song,English,"Massive multiple-input-multiple-output (MIMO) and millimeter wave have been adopted as the enabling technologies for the 5G and beyond 5G (B5G) systems. A challenging problem introduced by the use of large antenna size and wide bandwidth is beam squint, i.e., spatial-wideband effect. Beam squint can significantly degrade the channel estimation performance for conventional channel estimators. Research effort on channel estimation under beam squint conditions has been very limited. For the few available work that attempts to address this problem, they require either all subcarriers or multiple symbols used as pilot for channel estimation, so large overhead becomes inevitable. Therefore, in this paper, we propose an efficient channel estimation method that only requires a small number of subcarriers. The channel estimation problem is formulated as a nonlinear least squares optimization problem. Initial …",Article,https://ieeexplore.ieee.org/abstract/document/9726155/
2023,IEEE Transactions on Signal Processing 71,Tensor-based sparse Bayesian learning with intra-dimension correlation,"Yuhui Song, Zijun Gong, Yuanzhu Chen, Cheng Li",Yuhui Song,English,"Unlike the flat-view matrix, tensor provides an elegant representation to preserve the structure of data in the multidimensional nature. The wide use of tensor-based approaches highlights the limitation of matrix-based methods and has generated increasing needs in multidimensional data analytics. Driven by such demands, tensor decomposition with automatic rank determination has recently emerged as a promising tool for image processing, wireless communications and neural network compression. However, unlike the success in matrix-based schemes of exploring the correlation for performance improvement, existing tensor-based methods fail to consider the correlation structure in the tensor. In this paper, we propose to exploit the tensor intra-dimension correlation within the framework of sparse Bayesian learning. We provide the sparsity-inducing probabilistic models under both canonical polyadic …",Article,https://ieeexplore.ieee.org/abstract/document/10021855/
2023,IEEE Journal on Selected Areas in Communications,Simultaneous Localization and Communications With Massive MIMO-OTFS,"Zijun Gong, Fan Jiang, Cheng Li, Xuemin Shen",Zijun Gong,English,"Next generation cellular network is expected to provide the simultaneous high-accuracy localization and ultra-reliable communication services, even in high mobility scenarios. To that end, the novel orthogonal time frequency space (OTFS) modulation has been developed as a promising physical-layer transmission technique, evident by the outstanding performance in terms of robustness against time-frequency selective fading over the orthogonal frequency division multiplexing (OFDM) counterpart. However, when OTFS meets massive multiple-input multiple-output (MIMO), the specific conditions, under which the delay-Doppler (DD) domain channel model holds, are not identified. In addition, the channel estimation and localization performance in such system is rarely studied. In this work, we target at these new challenges, and conduct comprehensive modelling, performance analysis, and algorithm design for …",Article,https://ieeexplore.ieee.org/abstract/document/10274474/
2023,IEEE Internet of Things Journal,Trajectory Optimization for Target Localization Using Time Delays and Doppler Shifts in Bistatic Sonar-Based Internet of Underwater Things,"Chenglin Zhang, Wentao Shi, Zijun Gong, Qunfei Zhang, Cheng Li",Chenglin Zhang,English,"Efficient target localization is critical to many marine applications in the Internet of Underwater Things (IoUT). Doppler effect becomes more predominant in the underwater environment when the relative speed of the moving object, i.e., the observer, to the signal propagation speed in water is much larger than that in the air. This along with the observer-target geometry will bring in a notable impact on the localization performance. In this article, we derive the Cramér–Rao lower bound (CRLB) and formulate the A-optimality criterion-based observer trajectory optimization problem to improve the localization performance based on time delay and Doppler shift measurements. We show that in the worst case scenario, there will be a conflict between the nonaccessible zone constraint and the observer dynamics constraint, which will lead to an erroneous result. To address this problem, we propose a warning zone-based …",Article,https://ieeexplore.ieee.org/abstract/document/10104072/
2023,IEEE Transactions on Signal Processing,High-accuracy positioning services for high-speed vehicles in wideband mmwave communications,"Zijun Gong, Xuemin Sherman Shen, Cheng Li, Yuhui Song, Ruoyu Su",Zijun Gong,English,"It is expected that the sixth-generation (6G) cellular networks will provide high-accuracy positioning services. For the millimeter wave (mmWave) frequency band in 6G, both the Doppler and the spatial wideband effects can lead to channel variation in time and space domains, respectively. However, the impact of these effects on the positioning performance is not well studied. In this paper, we will investigate this issue and show that these two effects are not only challenges, but also provide great opportunities in terms of positioning in vehicular networks. Particularly, we will conduct system modeling, algorithm design, and fundamental performance analysis of simultaneous localization and communications (SLAC) in mmWave-based vehicular networks, exclusively dependent on channel state information. The major challenge in algorithm design is the high computational complexity that comes with the huge antenna …",Article,https://ieeexplore.ieee.org/abstract/document/10288428/
2023,IEEE/CAA Journal of Automatica Sinica,"Fundamental limits of doppler shift-based, TOA-based, and TDOA-based underwater localization","Zijun Gong, Cheng Li, Ruoyu Su",Zijun Gong,English,"Dear Editor, This paper is concerned with the underwater localization based on acoustic signals. Specifically, we will focus on the search of an underwater target that can constantly broadcast a beacon signal, such as a black box. Common measurements for localization are Doppler shift [1], time of arrival (ToA) [2]–[4], time difference of arrival (TDoA) [5], [6], angle of arrival (AoA) [7], etc. In this paper we will investigate the fundamental limits of Doppler shift-Based, ToA-Based, TDoA-based underwater localization. Note that AoA is not covered, because Doppler shift can be viewed as one type of AoA. The discussion will focus on short-baseline positioning with a mobile anchor, i.e., an autonomous underwater vehicle (AUV). Due to the large distance and the limited battery life of the AUV, the target is quite likely to lie outside the convex hull of the AUV's trajectory. In such cases, we will show that accurate localization is …",Article,https://ieeexplore.ieee.org/abstract/document/10153725/
2021,2021 International Wireless Communications and Mobile Computing (IWCMC …,A Mobile Node Assisted Localization System for Wireless Sensor Networks,"Ruoyu Su, Xiaolin Pang, Zijun Gong, Cheng Li, Xueheng Tao, Fan Jiang",Ruoyu Su,English,"Wireless sensor network (WSN), consisting of several sensor nodes, is one of the most promising technologies emerged in the past decade. The positioning system for WSN is particularly meaningful and widely used in the military surveillance, air-sea rescue, traffic monitoring, and etc. However, the traditional positioning system always suffers from deployment and maintenance of anchors. In this paper, we propose a positioning system employing a Raspberry Pi platform attached to a DJI drone as a mobile anchor. The DJI drone can serve as multiple virtual anchors by moving and broadcasting its location information periodically. Thus, it is possible to localize sensor node by itself when the sensor node collects the drone's position. A Gauss-Newton method is applied to improve the accuracy of the proposed positioning system. We also elaborate the adaption of the Gauss-Newton method with the geodetic …",Conference paper,https://ieeexplore.ieee.org/abstract/document/9498987/
2020,Encyclopedia of Wireless Networks,Multiple Access Techniques,"Fan Jiang, Zijun Gong, Kun Hao, Yan Zhang",Fan Jiang,English,"In cognitive radio networks, the media access control (MAC) protocols need to determine the availability of spectrum resource through spectrum sensing and coordinate with the other secondary users (SUs) for spectrum access, so that the spectrum resource is efficiently utilized without harmful interference to the primary users (PUs).",Article,https://link.springer.com/content/pdf/10.1007/978-3-319-78262-1_236.pdf
2024,IEEE Transactions on Vehicular Technology,Unsynchronized Underwater Localization with Isogradient Sound Speed Profile and Anchor Location Uncertainties,"Haiyan Zhao, Zijun Gong, Jing Yan, Cheng Li, Xinping Guan",Haiyan Zhao,English,"Precise underwater localization has been very challenging due to the unsynchronized clock, stratification effect, and anchor location uncertainties. Although some localization methods have been proposed, they are all based on very strong and certain impractical assumptions, such as perfect time synchronization, constant underwater sound speed, or absolutely accurate anchor location information. In this paper, we investigate the underwater localization problem under more realistic conditions. By jointly considering the isogradient underwater sound speed profile (SSP) and anchor location uncertainties, an unsynchronized localization algorithm based on time-differenceof-arrival (TDoA) measurements will be presented. The target node initiates the localization process and anchors will respond by reporting their location with the corresponding time stamps. Due to the isogradient SSP, the linear relation between …",Article,https://ieeexplore.ieee.org/abstract/document/10416699/
2023,IEEE Sensors Journal,Target tracking using time delay and Doppler shift with nonnegligible motion effect in bistatic sonar,"Chenglin Zhang, Wentao Shi, Zijun Gong, Qunfei Zhang, Cheng Li",Chenglin Zhang,English,"This article investigates the target tracking problem using time delay and Doppler shift measurements obtained by bistatic sonar. The motions of the target, transmitter and receiver result in their real locations to be different from the initial locations during every observation period. Knowing that the measurement model is related to the locations, neglecting the motion effect will bring model bias, especially when the motion speeds are significant relative to underwater sound speed. Incorporating the motion effect into the measurement model to address the model bias problem will introduce the unknown real locations to make the tracking problem challenging. We shall transform the unknown real locations to be expressions with respect to the target state by solving their corresponding quadratic equations. The motion-compensated extended Kalman filter (MC-EKF) is next developed by deriving exact Jacobian and using …",Article,https://ieeexplore.ieee.org/abstract/document/10145060/
2023,ICC 2023-IEEE International Conference on Communications,Joint doppler and direction of arrival (DOA) based underwater localization with a mobile anchor,"Cheng Li, Zijun Gong, Xueheng Tao",Cheng Li,English,"For underwater localization, mobile anchors are generally preferred because they are easy to deploy and retrieve, such as the autonomous underwater vehicle (AUV). However, a big disadvantage is that we can only install small sonar arrays on AUVs due to their limited size. This leads to poor angular domain resolution. On the other hand, the mobility makes it possible for us to capture multiple snapshots of the acoustic signals when the AUV is located at different positions, and synthesize a virtual array, i.e., the Doppler effect. In this case we can equivalently obtain a large virtual uniform planar array (UPA), which gives much higher spatial resolution and positioning accuracy. Mathematically, we have not only the DoA (Direction of Arrival) measurements, but also the Doppler shift measurements for positioning. In this paper, we propose a low-complexity algorithm to jointly estimate Doppler shift and DoA. Based on …",Conference paper,https://ieeexplore.ieee.org/abstract/document/10279662/
2021,2021 International Wireless Communications and Mobile Computing (IWCMC …,A Review of Channel Modeling Techniques for Internet of Underwater Things,"Ruoyu Su, Mingye Ju, Zijun Gong, Cheng Li, Ramachandran Venkatesan",Ruoyu Su,English,"Internet of underwater things (IoUT) attracts many interests in these years both in academia and industry, such as marine data collection, pollution monitoring, and offshore exploration. As a fundamental issue of IoUT, the underwater acoustic channel experiences long delay and temporal-spatial uncertainty compared with terrestrial communications and networks. It is difficult to capture full characteristics of the underwater acoustic channel by statistical models. In this paper, we investigate the properties of acoustic propagation in seawater and different underwater acoustic channel models. Moreover, we survey five underwater acoustic channel models, including ray-theoretical model, normal mode model, multipath expansion model, fast-field model, and parabolic equation model, which are the corresponding solutions of the wave equation. We conclude the paper with the characteristics of each model in terms of …",Conference paper,https://ieeexplore.ieee.org/abstract/document/9498623/
2024,IEEE Transactions on Signal Processing,High Accuracy AUV-Aided Underwater Localization: Far-Field Information Fusion Perspective,"Ruoyu Su, Zijun Gong, Cheng Li, Shuai Han",Ruoyu Su,English,"An autonomous underwater vehicle (AUV) can be employed to estimate an underwater target's position using the Doppler shift measurement extracted from received signals. Conventionally, the received signals have to be divided into several short frames so that the Doppler shift is constant in each one. When the AUV is far away from the target, the signal to noise ratio (SNR) is quite low. An intuitive solution is to increase the frame length to suppress noise and boost SNR. However, it is worth noting that the Doppler shift is actually changing over time, and the prolonged frame length will inevitably induce modeling error. This is a fundamental dilemma in the Doppler-shift-based underwater localization. In this paper, we reveal that the assumption of constant Doppler shift comes from the zero-th order Taylor expansion of the real-time model. To increase the frame length without jeopardizing the model accuracy, we …",Article,https://ieeexplore.ieee.org/abstract/document/10474484/
2022,Smart Ships,Smart AUV-Assisted Localization and Time Synchronization of Underwater Acoustic Devices,"Zijun Gong, Fan Jiang, Ruoyu Su, Cheng Li",Zijun Gong,English,"The localization and time synchronization of Underwater Acoustic Devices (UADs) have many potential applications in industry and scientific research. This can be done by deploying location-aware fixed anchors on the sea surface or bottom. However, this solution has poor accuracy and induces huge costs. In recent years, with the surge of Autonomous Underwater Vehicles (AUVs), the possibility of employing smart AUVs as mobile anchors have been extensively discussed. In this chapter, three smart AUV-assisted underwater localization and time synchronization techniques will be introduced, based on ToA (Time of Arrival), Doppler shift, and linear frequency modulated signals. The system model will be presented in detail, and the corresponding algorithms will be briefly discussed. For each of them, some preliminary numerical evaluations are conducted to directly show their performance.",Conference paper,https://www.taylorfrancis.com/chapters/edit/10.1201/9781003025924-8/smart-auv-assisted-localization-time-synchronization-underwater-acoustic-devices-zijun-gong-fan-jiang-ruoyu-su-cheng-li
2021,2021 International Wireless Communications and Mobile Computing (IWCMC …,Analysis of Outage Probability for Millimeter Wave Communications,"Ruoyu Su, Xiaolin Pang, Zijun Gong, Cheng Li, Xueheng Tao, Fan Jiang",Ruoyu Su,English,"As the data traffic in future wireless communications will explosively grow up to 1000-fold by the deployment of 5G, several technologies are emerging to satisfy this demand, including multiple-input multiple-output (MIMO), millimeter wave communications, Non-orthogonal Multiple Access (NOMA), etc. Millimeter wave communication is a promising solution since it can provide tens of GHz bandwidth by fundamentally exploring higher unoccupied spectrum resources. As the wavelength of higher frequency shrinks, it is possible to design more compact antenna array with large number of antennas with independent RF (Radio Frequency) chains, causing high cost and complexity. By exploring the spatial sparsity of the millimeter wave channels, lens antenna array has been investigated recently as a promising choice with limited RF chains and low complexity. In this paper, we investigate the outage probability for …",Conference paper,https://ieeexplore.ieee.org/abstract/document/9498811/
