Year,Sources,Name,Authors,First Author,Chinese/English,Abstract,Venues,doi,Citation,Id,Keywords
2024,arXiv preprint arXiv:2402.11420,Rethinking the Roles of Large Language Models in Chinese Grammatical Error Correction,"Yinghui Li, Shang Qin, Jingheng Ye, Shirong Ma, Yangning Li, Libo Qin, Xuming Hu, Wenhao Jiang, Hai-Tao Zheng, Philip S Yu",Yinghui Li,English,"Recently, Large Language Models (LLMs) have been widely studied by researchers for their roles in various downstream NLP tasks. As a fundamental task in the NLP field, Chinese Grammatical Error Correction (CGEC) aims to correct all potential grammatical errors in the input sentences. Previous studies have shown that LLMs' performance as correctors on CGEC remains unsatisfactory due to its challenging task focus. To promote the CGEC field to better adapt to the era of LLMs, we rethink the roles of LLMs in the CGEC task so that they can be better utilized and explored in CGEC. Considering the rich grammatical knowledge stored in LLMs and their powerful semantic understanding capabilities, we utilize LLMs as explainers to provide explanation information for the CGEC small models during error correction to enhance performance. We also use LLMs as evaluators to bring more reasonable CGEC evaluations, thus alleviating the troubles caused by the subjectivity of the CGEC task. In particular, our work is also an active exploration of how LLMs and small models better collaborate in downstream tasks. Extensive experiments and detailed analyses on widely used datasets verify the effectiveness of our thinking intuition and the proposed methods.",Article,https://arxiv.org/abs/2402.11420,3,li2024rethinking,"Large Language Models,Chinese Grammatical Error Correction (CGEC),NLP"
2023,arXiv preprint arXiv:2310.15743,RAPL: A Relation-Aware Prototype Learning Approach for Few-Shot Document-Level Relation Extraction,"Shiao Meng, Xuming Hu, Aiwei Liu, Shu'ang Li, Fukun Ma, Yawen Yang, Lijie Wen",Shiao Meng,English,"How to identify semantic relations among entities in a document when only a few labeled documents are available? Few-shot document-level relation extraction (FSDLRE) is crucial for addressing the pervasive data scarcity problem in real-world scenarios. Metric-based meta-learning is an effective framework widely adopted for FSDLRE, which constructs class prototypes for classification. However, existing works often struggle to obtain class prototypes with accurate relational semantics: 1) To build prototype for a target relation type, they aggregate the representations of all entity pairs holding that relation, while these entity pairs may also hold other relations, thus disturbing the prototype. 2) They use a set of generic NOTA (none-of-the-above) prototypes across all tasks, neglecting that the NOTA semantics differs in tasks with different target relation types. In this paper, we propose a relation-aware prototype learning method for FSDLRE to strengthen the relational semantics of prototype representations. By judiciously leveraging the relation descriptions and realistic NOTA instances as guidance, our method effectively refines the relation prototypes and generates task-specific NOTA prototypes. Extensive experiments demonstrate that our method outperforms state-of-the-art approaches by average 2.61%  across various settings of two FSDLRE benchmarks.",Article,https://arxiv.org/abs/2310.15743,3,meng2023rapl,"learning,relation-aware,few-shot,document-level,relation extraction,semantic"
2023,IEEE Transactions on Knowledge and Data Engineering,Reading Broadly to Open Your Mind Improving Open Relation Extraction With Search Documents Under Self-Supervisions,"Xuming Hu, Zhaochen Hong, Chenwei Zhang, Aiwei Liu, Shiao Meng, Lijie Wen, Irwin King, S Yu Philip",Xuming Hu,English,"Open relation extraction is the task of extracting open-domain relation facts from natural language sentences. Existing works either utilize distant-supervised annotations to train a supervised classifier over pre-defined relations, or adopt unsupervised methods with additional dependency on external assumptions. However, these works can only obtain information signals from limited existing knowledge bases or datasets. In this work, we propose a self-supervised framework named  Web-SelfORE , which exploits self-supervised signals by requiring a large pretrained language model to extensively read real-world relevant documents from the web, and obtain contextualized relational features by mixing contextualized representations of entities from different documents. We perform adaptive clustering on contextualized relational features and bootstrap the self-supervised signals by improving contextualized features?¡­",Article,https://ieeexplore.ieee.org/abstract/document/10255305/,3,hu2023reading,"Internet,Data mining,Online services,Encyclopedias,Annotations,Feature extraction,Knowledge based systems,Relation extraction,open-domain learning,retrieval-based learning,self-supervised learning"
2023,Proceedings of the 46th International ACM SIGIR Conference on Research and?¡­,Selflre: Self-refining representation learning for low-resource relation extraction,"Xuming Hu, Junzhe Chen, Shiao Meng, Lijie Wen, Philip S Yu",Xuming Hu,English,"Low-resource relation extraction (LRE) aims to extract potential relations from limited labeled corpus to handle the problem of scarcity of human annotations. Previous works mainly consist of two categories of methods: (1) Self-training methods, which improve themselves through the models' predictions, thus suffering from confirmation bias when the predictions are wrong. (2) Self-ensembling methods, which learn task-agnostic representations, therefore, generally do not work well for specific tasks. In our work, we propose a novel LRE architecture named SelfLRE, which leverages two complementary modules, one module uses self-training to obtain pseudo-labels for unlabeled data, and the other module uses self-ensembling learning to obtain the task-agnostic representations, and leverages the existing pseudo-labels to refine the better task-specific representations on unlabeled data. The two models are jointly?¡­",Conference paper,https://dl.acm.org/doi/abs/10.1145/3539618.3592058,3,hu2023selflre,"Low-resource Relation Extraction, Representation Learning"
2024,ACL,LLMArena: Assessing Capabilities of Large Language Models in Dynamic Multi-Agent Environments,"Junzhe Chen, Xuming Hu, Shuodi Liu, Shiyu Huang, Wei-Wei Tu, Zhaofeng He, Lijie Wen",Junzhe Chen,English,"Recent advancements in large language models (LLMs) have revealed their potential for achieving autonomous agents possessing human-level intelligence. However, existing benchmarks for evaluating LLM Agents either use static datasets, potentially leading to data leakage or focus only on single-agent scenarios, overlooking the complexities of multi-agent interactions. There is a lack of a benchmark that evaluates the diverse capabilities of LLM agents in multi-agent, dynamic environments. To this end, we introduce LLMArena, a novel and easily extensible framework for evaluating the diverse capabilities of LLM in multi-agent dynamic environments. LLMArena encompasses seven distinct gaming environments, employing Trueskill scoring to assess crucial abilities in LLM agents, including spatial reasoning, strategic planning, numerical reasoning, risk assessment, communication, opponent modeling, and team collaboration. We conduct an extensive experiment and human evaluation among different sizes and types of LLMs, showing that LLMs still have a significant journey ahead in their development towards becoming fully autonomous agents, especially in opponent modeling and team collaboration. We hope LLMArena could guide future research towards enhancing these capabilities in LLMs, ultimately leading to more sophisticated and practical applications in dynamic, multi-agent settings. The code and data will be available.",Article,https://arxiv.org/abs/2402.16499,2,chen2024llmarena,"large language models,multi-agent"
2022,COLING,Scene Graph Modification as Incremental Structure Expanding,"Xuming Hu, Zhijiang Guo, Yu Fu, Lijie Wen, Philip S Yu",Xuming Hu,English,"A scene graph is a semantic representation that expresses the objects, attributes, and relationships between objects in a scene. Scene graphs play an important role in many cross modality tasks, as they are able to capture the interactions between images and texts. In this paper, we focus on scene graph modification (SGM), where the system is required to learn how to update an existing scene graph based on a natural language query. Unlike previous approaches that rebuilt the entire scene graph, we frame SGM as a graph expansion task by introducing the incremental structure expanding (ISE). ISE constructs the target graph by incrementally expanding the source graph without changing the unmodified structure. Based on ISE, we further propose a model that iterates between nodes prediction and edges prediction, inferring more accurate and harmonious expansion decisions progressively. In addition, we construct a challenging dataset that contains more complicated queries and larger scene graphs than existing datasets. Experiments on four benchmarks demonstrate the effectiveness of our approach, which surpasses the previous state-of-the-art model by large margins.",Article,https://arxiv.org/abs/2209.09093,2,hu2022scene,"incremental structure,scene graph,query"
2023,ACL (Findings),Exploring the Compositional Generalization in Context Dependent Text-to-SQL Parsing,"Aiwei Liu, Wei Liu, Xuming Hu, Shuang Li, Fukun Ma, Yawen Yang, Lijie Wen",Aiwei Liu,English,"In the context-dependent Text-to-SQL task, the generated SQL statements are refined iteratively based on the user input utterance from each interaction. The input text from each interaction can be viewed as component modifications to the previous SQL statements, which could be further extracted as the modification patterns. Since these modification patterns could also be combined with other SQL statements, the models are supposed to have the compositional generalization to these novel combinations. This work is the first exploration of compositional generalization in context-dependent Text-to-SQL scenarios. To facilitate related studies, we constructed two challenging benchmarks named \textsc{CoSQL-CG} and \textsc{SParC-CG} by recombining the modification patterns and existing SQL statements. The following experiments show that all current models struggle on our proposed benchmarks. Furthermore, we found that better aligning the previous SQL statements with the input utterance could give models better compositional generalization ability. Based on these observations, we propose a method named \texttt{p-align} to improve the compositional generalization of Text-to-SQL models. Further experiments validate the effectiveness of our method. Source code and data are available.",Article,https://arxiv.org/abs/2306.04480,1,liu2023exploring,"compositional generalization,context dependent,text-to-sql"
2023,ACL,Give Me More Details: Improving Fact-Checking with Latent Retrieval,"Xuming Hu, Zhijiang Guo, Guanyu Wu, Lijie Wen, Philip S Yu",Xuming Hu,English,"Evidence plays a crucial role in automated fact-checking. When verifying real-world claims, existing fact-checking systems either assume the evidence sentences are given or use the search snippets returned by the search engine. Such methods ignore the challenges of collecting evidence and may not provide sufficient information to verify real-world claims. Aiming at building a better fact-checking system, we propose to incorporate full text from source documents as evidence and introduce two enriched datasets. The first one is a multilingual dataset, while the second one is monolingual (English). We further develop a latent variable model to jointly extract evidence sentences from documents and perform claim verification. Experiments indicate that including source documents can provide sufficient contextual clues even when gold evidence sentences are not annotated. The proposed system is able to achieve significant improvements upon best-reported models under different settings.",Article,https://arxiv.org/abs/2305.16128,1,hu2023give,"Automated Fact-Checking, Real-world Systems, Latent Variable Models, Evidence Retrieval, Claim Verification"
2024,Proceedings of the 47th International ACM SIGIR Conference on Research and?¡­,Preventing and Detecting Misinformation Generated by Large Language Models,"Aiwei Liu, Qiang Sheng, Xuming Hu",Aiwei Liu,English,"As large language models (LLMs) become increasingly capable and widely deployed, the risk of them generating misinformation poses a critical challenge. Misinformation from LLMs can take various forms, from factual errors due to hallucination to intentionally deceptive content, and can have severe consequences in high-stakes domains.This tutorial covers comprehensive strategies to prevent and detect misinformation generated by LLMs. We first introduce the types of misinformation LLMs can produce and their root causes. We then explore two broad categories: Preventing misinformation generation: a) AI alignment training techniques to reduce LLMs' propensity for misinformation and refuse malicious instructions during model training. b) Training-free mitigation methods like prompt guardrails, retrieval-augmented generation (RAG), and decoding strategies to curb misinformation at inference time. Detecting?¡­",Conference paper,https://dl.acm.org/doi/abs/10.1145/3626772.3661377,0,liu2024preventing,"Large Language Models, Misinformation, Hallucination"
2024,arXiv preprint arXiv:2406.11193,MMNeuron: Discovering Neuron-Level Domain-Specific Interpretation in Multimodal Large Language Model,"Jiahao Huo, Yibo Yan, Boren Hu, Yutao Yue, Xuming Hu",Jiahao Huo,English,"Projecting visual features into word embedding space has become a significant fusion strategy adopted by Multimodal Large Language Models (MLLMs). However, its internal mechanisms have yet to be explored. Inspired by multilingual research, we identify domain-specific neurons in multimodal large language models. Specifically, we investigate the distribution of domain-specific neurons and the mechanism of how MLLMs process features from diverse domains. Furthermore, we propose a three-stage framework for language model modules in MLLMs when handling projected image features, and verify this hypothesis using logit lens. Extensive experiments indicate that while current MLLMs exhibit Visual Question Answering (VQA) capability, they may not fully utilize domain-specific information. Manipulating domain-specific neurons properly will result in a 10\% change of accuracy at most, shedding light on the development of cross-domain, all-encompassing MLLMs in the future. Our code will be released upon paper notification.",Article,https://arxiv.org/abs/2406.11193,0,huo2024mmneuron,"Multimodal Large Language Models,domain-specific neurons,cross-domain"
2024,arXiv preprint arXiv:2406.11357,Refiner: Restructure Retrieval Content Efficiently to Advance Question-Answering Capabilities,"Zhonghao Li, Xuming Hu, Aiwei Liu, Kening Zheng, Sirui Huang, Hui Xiong",Zhonghao Li,English,"Large Language Models (LLMs) are limited by their parametric knowledge, leading to hallucinations in knowledge-extensive tasks. To address this, Retrieval-Augmented Generation (RAG) incorporates external document chunks to expand LLM knowledge. Furthermore, compressing information from document chunks through extraction or summarization can improve LLM performance. Nonetheless, LLMs still struggle to notice and utilize scattered key information, a problem known as the ""lost-in-the-middle"" syndrome. Therefore, we typically need to restructure the content for LLM to recognize the key information. We propose , an end-to-end extract-and-restructure paradigm that operates in the post-retrieval process of RAG.  leverages a single decoder-only LLM to adaptively extract query-relevant contents verbatim along with the necessary context, and section them based on their interconnectedness, thereby highlights information distinction, and aligns downstream LLMs with the original context effectively. Experiments show that a trained  (with 7B parameters) exhibits significant gain to downstream LLM in improving answer accuracy, and outperforms other state-of-the-art advanced RAG and concurrent compressing approaches in various single-hop and multi-hop QA tasks. Notably,  achieves a 80.5% tokens reduction and a 1.6-7.0% improvement margin in multi-hop tasks compared to the next best solution.  is a plug-and-play solution that can be seamlessly integrated with RAG systems, facilitating its application across diverse open-source frameworks.",Article,https://arxiv.org/abs/2406.11357,0,li2024refiner,"Large Language Models,Retrieval-Augmented Generation (RAG),end-to-end"
2024,ACL (Findings),On the Robustness of Document-Level Relation Extraction Models to Entity Name Variations,"Shiao Meng, Xuming Hu, Aiwei Liu, Fukun Ma, Yawen Yang, Shuang Li, Lijie Wen",Shiao Meng,English,"Driven by the demand for cross-sentence and large-scale relation extraction, document-level relation extraction (DocRE) has attracted increasing research interest. Despite the continuous improvement in performance, we find that existing DocRE models which initially perform well may make more mistakes when merely changing the entity names in the document, hindering the generalization to novel entity names. To this end, we systematically investigate the robustness of DocRE models to entity name variations in this work. We first propose a principled pipeline to generate entity-renamed documents by replacing the original entity names with names from Wikidata. By applying the pipeline to DocRED and Re-DocRED datasets, we construct two novel benchmarks named Env-DocRED and Env-Re-DocRED for robustness evaluation. Experimental results show that both three representative DocRE models and two in-context learned large language models consistently lack sufficient robustness to entity name variations, particularly on cross-sentence relation instances and documents with more entities. Finally, we propose an entity variation robust training method which not only improves the robustness of DocRE models but also enhances their understanding and reasoning capabilities. We further verify that the basic idea of this method can be effectively transferred to in-context learning for DocRE as well.",Article,https://arxiv.org/abs/2406.07444,0,meng2024robustness," document-level relation extraction,benchmark,robustness"
2024,arXiv preprint arXiv:2405.10051,MarkLLM: An Open-Source Toolkit for LLM Watermarking,"Leyi Pan, Aiwei Liu, Zhiwei He, Zitian Gao, Xuandong Zhao, Yijian Lu, Binglin Zhou, Shuliang Liu, Xuming Hu, Lijie Wen, Irwin King",Leyi Pan,English,"LLM watermarking, which embeds imperceptible yet algorithmically detectable signals in model outputs to identify LLM-generated text, has become crucial in mitigating the potential misuse of large language models. However, the abundance of LLM watermarking algorithms, their intricate mechanisms, and the complex evaluation procedures and perspectives pose challenges for researchers and the community to easily experiment with, understand, and assess the latest advancements. To address these issues, we introduce MarkLLM, an open-source toolkit for LLM watermarking. MarkLLM offers a unified and extensible framework for implementing LLM watermarking algorithms, while providing user-friendly interfaces to ensure ease of access. Furthermore, it enhances understanding by supporting automatic visualization of the underlying mechanisms of these algorithms. For evaluation, MarkLLM offers a comprehensive suite of 12 tools spanning three perspectives, along with two types of automated evaluation pipelines. Through MarkLLM, we aim to support researchers while improving the comprehension and involvement of the general public in LLM watermarking technology, fostering consensus and driving further advancements in research and application. Our code is available at https://github.com/THU-BPM/MarkLLM.",Article,https://arxiv.org/abs/2405.10051,0,pan2024markllm,"LLM watermarking,toolkit"
2024,AAAI,Three Heads Are Better than One: Improving Cross-Domain NER with Progressive Decomposed Network,"Xuming Hu, Zhaochen Hong, Yong Jiang, Zhichao Lin, Xiaobin Wang, Pengjun Xie, S Yu Philip",Xuming Hu,English,"Cross-domain named entity recognition (NER) tasks encourage NER models to transfer knowledge from data-rich source domains to sparsely labeled target domains. Previous works adopt the paradigms of pre-training on the source domain followed by fine-tuning on the target domain. However, these works ignore that general labeled NER source domain data can be easily retrieved in the real world, and soliciting more source domains could bring more benefits. Unfortunately, previous paradigms cannot efficiently transfer knowledge from multiple source domains. In this work, to transfer multiple source domains' knowledge, we decouple the NER task into the pipeline tasks of mention detection and entity typing, where the mention detection unifies the training object across domains, thus providing the entity typing with higher-quality entity mentions. Additionally, we request multiple general source domain models to suggest the potential named entities for sentences in the target domain explicitly, and transfer their knowledge to the target domain models through the knowledge progressive networks implicitly. Furthermore, we propose two methods to analyze in which source domain knowledge transfer occurs, thus helping us judge which source domain brings the greatest benefit. In our experiment, we develop a Chinese cross-domain NER dataset. Our model improved the F1 score by an average of 12.50% across 8 Chinese and English datasets compared to models without source domain data.",Article,https://ojs.aaai.org/index.php/AAAI/article/view/29785,0,hu2024three,"Cross-domain,Named Entity Recognition (NER),knowledge progressive networks"
2024,arXiv preprint arXiv:2403.04247,UltraWiki: Ultra-fine-grained Entity Set Expansion with Negative Seed Entities,"Yangning Li, Qingsong Lv, Tianyu Yu, Yinghui Li, Shulin Huang, Tingwei Lu, Xuming Hu, Wenhao JIang, Hai-Tao Zheng, Hui Wang",Yangning Li,English,"Entity Set Expansion (ESE) aims to identify new entities belonging to the same semantic class as a given set of seed entities. Traditional methods primarily relied on positive seed entities to represent a target semantic class, which poses challenge for the representation of ultra-fine-grained semantic classes. Ultra-fine-grained semantic classes are defined based on fine-grained semantic classes with more specific attribute constraints. Describing it with positive seed entities alone cause two issues: (i) Ambiguity among ultra-fine-grained semantic classes. (ii) Inability to define ""unwanted"" semantic. Due to these inherent shortcomings, previous methods struggle to address the ultra-fine-grained ESE (Ultra-ESE). To solve this issue, we first introduce negative seed entities in the inputs, which belong to the same fine-grained semantic class as the positive seed entities but differ in certain attributes. Negative seed entities eliminate the semantic ambiguity by contrast between positive and negative attributes. Meanwhile, it provide a straightforward way to express ""unwanted"". To assess model performance in Ultra-ESE, we constructed UltraWiki, the first large-scale dataset tailored for Ultra-ESE. UltraWiki encompasses 236 ultra-fine-grained semantic classes, where each query of them is represented with 3-5 positive and negative seed entities. A retrieval-based framework RetExpan and a generation-based framework GenExpan are proposed to comprehensively assess the efficacy of large language models from two different paradigms in Ultra-ESE. Moreover, we devised three strategies to enhance models' comprehension of ultra-fine-grained entities?¡­",Article,https://arxiv.org/abs/2403.04247,0,li2024ultrawiki,"Entity Set Expansion,ultra-fine-grained,dataset,semantic"
2024,arXiv preprint arXiv:2402.16367,Unraveling Babel: Exploring Multilingual Activation Patterns within Large Language Models,"Weize Liu, Yinlong Xu, Hongxia Xu, Jintai Chen, Xuming Hu, Jian Wu",Weize Liu,English,"Recently, large language models (LLMs) have achieved tremendous breakthroughs in the field of language processing, yet their mechanisms in processing multiple languages remain agnostic. Therefore, in this work we study the multilingual activation patterns of LLMs. By transforming the original Large Language Models (LLMs) into a Mixture of Experts (MoE) architecture, we analyze the expert activation patterns when processing various languages and demonstrate the connections of these activation patterns at the level of language families. We discover the existence of non-language-specific neurons as well as language-specific activation neurons. Further exploration even showcases that merely leveraging high-frequency activation neurons can accelerate inference while maintaining comparable performance. These findings shed light on the LLMs' multilingual processing mechanism, and are of significant importance in guiding the multilingual training and model pruning of LLMs.",Article,https://arxiv.org/abs/2402.16367,0,liu2024unraveling,"large language models,multilingual,activation patterns,pruning"
