Year,Sources,Name,Authors,First Author,Chinese/English,Abstract,Venues,doi,Citation,Id,Keywords
2023,Proceedings of the 61st Annual Meeting of the Association for Computational?¡­,AMR-based network for aspect-based sentiment analysis,"Fukun Ma, Xuming Hu, Aiwei Liu, Yawen Yang, S Yu Philip, Lijie Wen",Fukun Ma,English,"Aspect-based sentiment analysis (ABSA) is a fine-grained sentiment classification task. Many recent works have used dependency trees to extract the relation between aspects and contexts and have achieved significant improvements. However, further improvement is limited due to the potential mismatch between the dependency tree as a syntactic structure and the sentiment classification as a semantic task. To alleviate this gap, we replace the syntactic dependency tree with the semantic structure named Abstract Meaning Representation (AMR) and propose a model called AMR-based Path Aggregation Relational Network (APARN) to take full advantage of semantic structures. In particular, we design the path aggregator and the relation-enhanced self-attention mechanism that complement each other. The path aggregator extracts semantic features from AMRs under the guidance of sentence information, while the relation-enhanced self-attention mechanism in turn improves sentence features with refined semantic information. Experimental results on four public datasets demonstrate 1.13% average F1 improvement of APARN in ABSA when compared with state-of-the-art baselines.",Conference paper,https://aclanthology.org/2023.acl-long.19/,14,ma2023amr,"Aspect-based sentiment analysis,relation extraction,semantic"
2022,COLING,Domain-Specific NER via Retrieving Correlated Samples,"Xin Zhang, Yong Jiang, Xiaobin Wang, Xuming Hu, Yueheng Sun, Pengjun Xie, Meishan Zhang",Xin Zhang,English,"Successful Machine Learning based Named Entity Recognition models could fail on texts from some special domains, for instance, Chinese addresses and e-commerce titles, where requires adequate background knowledge. Such texts are also difficult for human annotators. In fact, we can obtain some potentially helpful information from correlated texts, which have some common entities, to help the text understanding. Then, one can easily reason out the correct answer by referencing correlated samples. In this paper, we suggest enhancing NER models with correlated samples. We draw correlated samples by the sparse BM25 retriever from large-scale in-domain unlabeled data. To explicitly simulate the human reasoning process, we perform a training-free entity type calibrating by majority voting. To capture correlation features in the training stage, we suggest to model correlated samples by the transformer-based multi-instance cross-encoder. Empirical results on datasets of the above two domains show the efficacy of our methods.",Article,https://arxiv.org/abs/2208.12995,13,zhang2022domain,"correlated samples,domain-specific,Named Entity Recognition (NER)"
2022,SIGIR,What Makes the Story Forward? Inferring Commonsense Explanations as Prompts for Future Event Generation,"Li Lin, Yixin Cao, Lifu Huang, Shuang Li, Xuming Hu, Lijie Wen, Jianmin Wang",Li Lin,English,"Prediction over event sequences is critical for many real-world applications in Information Retrieval and Natural Language Processing. Future Event Generation (FEG) is a challenging task in event sequence prediction because it requires not only fluent text generation but also commonsense reasoning to maintain the logical coherence of the entire event story. In this paper, we propose a novel explainable FEG framework, Coep. It highlights and integrates two types of event knowledge, sequential knowledge of direct event-event relations and inferential knowledge that reflects the intermediate character psychology between events, such as intents, causes, reactions, which intrinsically pushes the story forward. To alleviate the knowledge forgetting issue, we design two modules, IM and GM, for each type of knowledge, which are combined via prompt tuning. First, IM focuses on understanding inferential knowledge to?¡­",Article,https://dl.acm.org/doi/abs/10.1145/3477495.3532080,13,lin2022makes,"Textual Event Generation, Commonsense Reasoning, Contrastive Training"
2023,ACL (Findings),GDA: Generative Data Augmentation Techniques for Relation Extraction Tasks,"Xuming Hu, Aiwei Liu, Zeqi Tan, Xin Zhang, Chenwei Zhang, Irwin King, Philip S Yu",Xuming Hu,English,"Relation extraction (RE) tasks show promising performance in extracting relations from two entities mentioned in sentences, given sufficient annotations available during training. Such annotations would be labor-intensive to obtain in practice. Existing work adopts data augmentation techniques to generate pseudo-annotated sentences beyond limited annotations. These techniques neither preserve the semantic consistency of the original sentences when rule-based augmentations are adopted, nor preserve the syntax structure of sentences when expressing relations using seq2seq models, resulting in less diverse augmentations. In this work, we propose a dedicated augmentation technique for relational texts, named GDA, which uses two complementary modules to preserve both semantic consistency and syntax structures. We adopt a generative formulation and design a multi-tasking solution to achieve synergies. Furthermore, GDA adopts entity hints as the prior knowledge of the generative model to augment diverse sentences. Experimental results in three datasets under a low-resource setting showed that GDA could bring {\em 2.0\%} F1 improvements compared with no augmentation technique. Source code and data are available.",Article,https://arxiv.org/abs/2305.16663,12,hu2023gda,"relation extraction,data argmentation"
2023,arXiv preprint arXiv:2312.07913,A survey of text watermarking in the era of large language models,"Aiwei Liu, Leyi Pan, Yijian Lu, Jingjing Li, Xuming Hu, Lijie Wen, Irwin King, Philip S Yu",Aiwei Liu,English,"In recent years, significant advancements have been made in the text generation capabilities of Large Language Models (LLMs), demonstrating exceptional performance in downstream tasks such as abstract summarization, dialogue generation, and data-to-text conversion. However, their generative abilities also pose risks such as the rapid spread of fake news, infringement of datasets/LLM copyrights, and challenges to academic integrity. Text watermarking technology emerges as a potential solution. By embedding invisible yet detectable patterns in generated texts, it helps in tracking and verifying text origins, thus preventing misuse and piracy. This survey aims to comprehensively summarize current text watermarking technologies, covering three main aspects: (1) an overview and comparison of different text watermarking techniques; (2) evaluation methods for text watermarking algorithms, including their success rate, impact on text quality, robustness, and unforgeability; (3) potential applications of text watermarking technologys. This survey aims to help researchers thoroughly understanding the text watermarking technologies, thereby fostering further development.",Article,https://arxiv.org/abs/2312.07913,11,liu2023survey,"Text Watermark, Large Language Models, Copyright Protection"
2022,arXiv preprint arXiv:2210.10343,Entity-to-text based data augmentation for various named entity recognition tasks,"Xuming Hu, Yong Jiang, Aiwei Liu, Zhongqiang Huang, Pengjun Xie, Fei Huang, Lijie Wen, Philip S Yu",Xuming Hu,English,"Data augmentation techniques have been used to alleviate the problem of scarce labeled data in various NER tasks (flat, nested, and discontinuous NER tasks). Existing augmentation techniques either manipulate the words in the original text that break the semantic coherence of the text, or exploit generative models that ignore preserving entities in the original text, which impedes the use of augmentation techniques on nested and discontinuous NER tasks. In this work, we propose a novel Entity-to-Text based data augmentation technique named EnTDA to add, delete, replace or swap entities in the entity list of the original texts, and adopt these augmented entity lists to generate semantically coherent and entity preserving texts for various NER tasks. Furthermore, we introduce a diversity beam search to increase the diversity during the text generation process. Experiments on thirteen NER datasets across three tasks (flat, nested, and discontinuous NER tasks) and two settings (full data and low resource settings) show that EnTDA could bring more performance improvements compared to the baseline augmentation techniques.",Article,https://arxiv.org/abs/2210.10343,6,hu2022entity,"data augmentation,entity-to-text,Named Entity Recognition (NER)"
2023,ACL,Multimodal Relation Extraction with Cross-Modal Retrieval and Synthesis,"Xuming Hu, Zhijiang Guo, Zhiyang Teng, Irwin King, Philip S Yu",Xuming Hu,English,"Multimodal relation extraction (MRE) is the task of identifying the semantic relationships between two entities based on the context of the sentence image pair. Existing retrieval-augmented approaches mainly focused on modeling the retrieved textual knowledge, but this may not be able to accurately identify complex relations. To improve the prediction, this research proposes to retrieve textual and visual evidence based on the object, sentence, and whole image. We further develop a novel approach to synthesize the object-level, image-level, and sentence-level information for better reasoning between the same and different modalities. Extensive experiments and analyses show that the proposed method is able to effectively select and compare evidence across modalities and significantly outperforms state-of-the-art models.",Article,https://arxiv.org/abs/2305.16166,9,hu2023multimodal,"multimodal,relation extraction,cross-modal,retrieval"
2023,AAAI,Graph Component Contrastive Learning for Concept Relatedness Estimation,"Yueen Ma, Zixing Song, Xuming Hu, Jingjing Li, Yifei Zhang, Irwin King",Yueen Ma,English,"Concept relatedness estimation (CRE) aims to determine whether two given concepts are related. Existing methods only consider the pairwise relationship between concepts, while overlooking the higher-order relationship that could be encoded in a concept-level graph structure. We discover that this underlying graph satisfies a set of intrinsic properties of CRE, including reflexivity, commutativity, and transitivity. In this paper, we formalize the CRE properties and introduce a graph structure named ConcreteGraph. To address the data scarcity issue in CRE, we introduce a novel data augmentation approach to sample new concept pairs from the graph. As it is intractable for data augmentation to fully capture the structural information of the ConcreteGraph due to a large amount of potential concept pairs, we further introduce a novel Graph Component Contrastive Learning framework to implicitly learn the complete structure of the ConcreteGraph. Empirical results on three datasets show significant improvement over the state-of-the-art model. Detailed ablation studies demonstrate that our proposed approach can effectively capture the high-order relationship among concepts.",Article,https://ojs.aaai.org/index.php/AAAI/article/view/26568,9,ma2023graph,"Concept relatedness estimation,data argmentation,contrastive learning,graph"
2023,SIGIR,Read it Twice: Towards Faithfully Interpretable Fact Verification by Revisiting Evidence,"Xuming Hu, Zhaochen Hong, Zhijiang Guo, Lijie Wen, Philip S Yu",Xuming Hu,English,"Real-world fact verification task aims to verify the factuality of a claim by retrieving evidence from the source document. The quality of the retrieved evidence plays an important role in claim verification. Ideally, the retrieved evidence should be faithful (reflecting the model's decision-making process in claim verification) and plausible (convincing to humans), and can improve the accuracy of verification task. Although existing approaches leverage the similarity measure of semantic or surface form between claims and documents to retrieve evidence, they all rely on certain heuristics that prevent them from satisfying all three requirements. In light of this, we propose a fact verification model named ReRead to retrieve evidence and verify claim that: (1) Train the evidence retriever to obtain interpretable evidence (i.e., faithfulness and plausibility criteria); (2) Train the claim verifier to revisit the evidence retrieved by the?¡­",Article,https://dl.acm.org/doi/abs/10.1145/3539618.3592049,8,hu2023read,"Automated Fact-Checking, Real-world Systems, Latent Variable Models, Evidence Retrieval, Claim Verification"
2021,IEEE Transactions on Services Computing,MespaConfig: Memory-Sparing Configuration Auto-Tuning for Co-Located In-Memory Cluster Computing Jobs,"Zan Zong, Lijie Wen, Xuming Hu, Rui Han, Chen Qian, Li Lin",Zan Zong,English,"Distributed in-memory computing frameworks usually have lots of parameters (e.g., the buffer size of shuffle) to form a configuration for each execution. A well-tuned configuration can bring large improvements of performance. However, to improve resource utilization, jobs are often share the same cluster, which causes dynamic cluster load conditions. According to our observation, the variation of cluster load reduces effectiveness of configuration tuning. Besides, as a common problem of cluster computing jobs, overestimation of resources also occurs during configuration tuning. It is challenging to efficiently find the optimal configuration in a shared cluster with the consideration of memory-sparing. In this article, we introduce MespaConfig, a job-level configuration optimizer for distributed in-memory computing jobs. Advancements of MespaConfig over previous work are features including memory-sparing and load?¡­",Article,https://ieeexplore.ieee.org/abstract/document/9367004/,8,zong2021mespaconfig,"Configuration tuning,in-memory computing,memory-sparing,performance optimization,co-locate"
2024,arXiv preprint arXiv:2402.11100,When llms meet cunning questions: A fallacy understanding benchmark for large language models,"Yinghui Li, Qingyu Zhou, Yuanzhen Luo, Shirong Ma, Yangning Li, Hai-Tao Zheng, Xuming Hu, Philip S Yu",Yinghui Li,English,"Recently, Large Language Models (LLMs) have made remarkable evolutions in language understanding and generation. Following this, various benchmarks for measuring all kinds of capabilities of LLMs have sprung up. In this paper, we challenge the reasoning and understanding abilities of LLMs by proposing a FaLlacy Understanding Benchmark (FLUB) containing cunning questions that are easy for humans to understand but difficult for models to grasp. Specifically, the cunning questions that FLUB focuses on mainly consist of the tricky, humorous, and misleading questions collected from the real internet environment. And we design three tasks with increasing difficulty in the FLUB benchmark to evaluate the fallacy understanding ability of LLMs. Based on FLUB, we investigate the performance of multiple representative and advanced LLMs, reflecting our FLUB is challenging and worthy of more future study. Interesting discoveries and valuable insights are achieved in our extensive experiments and detailed analyses. We hope that our benchmark can encourage the community to improve LLMs' ability to understand fallacies.",Article,https://arxiv.org/abs/2402.11100,7,li2024llms,"Large Language Models,texts,benchmark"
2023,ICASSP,Gaussian Prior Reinforcement Learning for Nested Named Entity Recognition,"Yawen Yang, Xuming Hu, Fukun Ma, Aiwei Liu, Lijie Wen, S Yu Philip",Yawen Yang,English,"Named Entity Recognition (NER) is a well and widely studied task in natural language processing. Recently, the nested NER has attracted more attention since its practicality and difficulty. Existing works for nested NER ignore the recognition order and boundary position relation of nested entities. To address these issues, we propose a novel seq2seq model named GPRL, which formulates the nested NER task as an entity triplet sequence generation process. GPRL adopts the reinforcement learning method to generate entity triplets de-coupling the entity order in gold labels and expects to learn a reasonable recognition order of entities via trial and error. Based on statistics of boundary distance for nested entities, GPRL designs a Gaussian prior to represent the boundary distance distribution between nested entities and adjust the out-put probability distribution of nested boundary tokens. Experiments on three?¡­",Conference paper,https://ieeexplore.ieee.org/abstract/document/10097163/,6,yang2023gaussian,"Nested NER, Entity Triplet Sequence, Gaussian Prior, Reinforcement Learning"
2023,SIGIR,Think Rationally about What You See: Continuous Rationale Extraction for Relation Extraction,"Xuming Hu, Zhaochen Hong, Chenwei Zhang, Irwin King, Philip S Yu",Xuming Hu,English,"Relation extraction (RE) aims to extract potential relations according to the context of two entities, thus, deriving rational contexts from sentences plays an important role. Previous works either focus on how to leverage the entity information (e.g., entity types, entity verbalization) to inference relations, but ignore context-focused content, or use counterfactual thinking to remove the model's bias of potential relations in entities, but the relation reasoning process will still be hindered by irrelevant content. Therefore, how to preserve relevant content and remove noisy segments from sentences is a crucial task. In addition, retained content needs to be fluent enough to maintain semantic coherence and interpretability. In this work, we propose a novel rationale extraction framework named RE2, which leverages two continuity and sparsity factors to obtain relevant and coherent rationales from sentences. To solve the problem?¡­",Article,https://dl.acm.org/doi/abs/10.1145/3539618.3592072,6,hu2023think,"Continuous Rationale Extraction, Relation Extraction"
2023,Proceedings of the 31st ACM International Conference on Multimedia,Prompt me up: Unleashing the power of alignments for multimodal entity and relation extraction,"Xuming Hu, Junzhe Chen, Aiwei Liu, Shiao Meng, Lijie Wen, Philip S Yu",Xuming Hu,English,"How can we better extract entities and relations from text? Using multimodal extraction with images and text obtains more signals for entities and relations, and aligns them through graphs or hierarchical fusion, aiding in extraction. Despite attempts at various fusions, previous works have overlooked many unlabeled image-caption pairs, such as NewsCLIPing. This paper proposes innovative pre-training objectives for entity-object and relation-image alignment, extracting objects from images and aligning them with entity and relation prompts for soft pseudo-labels. These labels are used as self-supervised signals for pre-training, enhancing the ability to extract entities and relations. Experiments on three datasets show an average 3.41% F1 improvement over prior SOTA. Additionally, our method is orthogonal to previous multimodal fusions, and using it on prior SOTA fusions further improves 5.47% F1.",Conference paper,https://dl.acm.org/doi/abs/10.1145/3581783.3611899,5,hu2023prompt,"Multimodal Named Entity Recognition, Multimodal Relation Ex- traction, Entity-Object and Relation-Image Aligned Pre-training"
2022,EMNLP,Query-based Instance Discrimination Network for Relational Triple Extraction,"Zeqi Tan, Yongliang Shen, Xuming Hu, Wenqi Zhang, Xiaoxia Cheng, Weiming Lu, Yueting Zhuang",Zeqi Tan,English,"Joint entity and relation extraction has been a core task in the field of information extraction. Recent approaches usually consider the extraction of relational triples from a stereoscopic perspective, either learning a relation-specific tagger or separate classifiers for each relation type. However, they still suffer from error propagation, relation redundancy and lack of high-level connections between triples. To address these issues, we propose a novel query-based approach to construct instance-level representations for relational triples. By metric-based comparison between query embeddings and token embeddings, we can extract all types of triples in one step, thus eliminating the error propagation problem. In addition, we learn the instance-level representation of relational triples via contrastive learning. In this way, relational triples can not only enclose rich class-level semantics but also access to high-order global connections. Experimental results show that our proposed method achieves the state of the art on five widely used benchmarks.",Article,https://arxiv.org/abs/2211.01797,5,tan2022query,"instance discrimination network,relational triple,relation extraction,instance level,embedding"
2023,Findings of the Association for Computational Linguistics: ACL 2023,Automatic table union search with tabular representation learning,"Xuming Hu, Shen Wang, Xiao Qin, Chuan Lei, Zhengyuan Shen, Christos Faloutsos, Asterios Katsifodimos, George Karypis, Lijie Wen, S Yu Philip",Xuming Hu,English,"Given a data lake of tabular data as well as a query table, how can we retrieve all the tables in the data lake that can be unioned with the query table? Table union search constitutes an essential task in data discovery and preparation as it enables data scientists to navigate massive open data repositories. Existing methods identify uniability based on column representations (word surface forms or token embeddings) and column relation represented by column representation similarity. However, the semantic similarity obtained between column representations is often insufficient to reveal latent relational features to describe the column relation between pair of columns and not robust to the table noise. To address these issues, in this paper, we propose a multi-stage self-supervised table union search framework called AutoTUS, which represents column relation as a vector¨Ccolumn relational representation and learn column relational representation in a multi-stage manner that can better describe column relation for unionability prediction. In particular, the large language model powered contextualized column relation encoder is updated by adaptive clustering and pseudo label classification iteratively so that the better column relational representation can be learned. Moreover, to improve the robustness of the model against table noises, we propose table noise generator to add table noise to the training table data. Experiments on real-world datasets as well as synthetic test set augmented with table noise show that AutoTUS achieves 5.2% performance gain over the SOTA baseline.",Conference paper,https://aclanthology.org/2023.findings-acl.233/,4,hu2023automatic,"table union search,representation learning,table noise"
2023,ACL (Findings),Enhancing Cross-lingual Natural Language Inference by Soft Prompting with Multilingual Verbalizer,"Shuang Li, Xuming Hu, Aiwei Liu, Yawen Yang, Fukun Ma, Philip S Yu, Lijie Wen",Shuang Li,English,"Cross-lingual natural language inference is a fundamental problem in cross-lingual language understanding. Many recent works have used prompt learning to address the lack of annotated parallel corpora in XNLI. However, these methods adopt discrete prompting by simply translating the templates to the target language and need external expert knowledge to design the templates. Besides, discrete prompts of human-designed template words are not trainable vectors and can not be migrated to target languages in the inference stage flexibly. In this paper, we propose a novel Soft prompt learning framework with the Multilingual Verbalizer (SoftMV) for XNLI. SoftMV first constructs cloze-style question with soft prompts for the input sample. Then we leverage bilingual dictionaries to generate an augmented multilingual question for the original question. SoftMV adopts a multilingual verbalizer to align the representations of original and augmented multilingual questions into the same semantic space with consistency regularization. Experimental results on XNLI demonstrate that SoftMV can achieve state-of-the-art performance and significantly outperform the previous methods under the few-shot and full-shot cross-lingual transfer settings.",Article,https://arxiv.org/abs/2305.12761,4,li2023enhancing,"multilingual verbalizer,soft prompting,language,inference,cross-lingual"
