Year,Sources,Name,Authors,First Author,Chinese/English,Abstract,Venues,doi,Citation,Id,Keywords
2022,IEEE Transactions on Visualization and Computer Graphics,Towards Natural Language Interfaces for Data Visualization: A Survey,"Leixian Shen, Enya Shen, Yuyu Luo, Xiaocong Yang, Xuming Hu, Xiongshuai Zhang, Zhiwei Tai, Jianmin Wang",Leixian Shen,English,"Utilizing Visualization-oriented Natural Language Interfaces (V-NLI) as a complementary input modality to direct manipulation for visual analytics can provide an engaging user experience. It enables users to focus on their tasks rather than having to worry about how to operate visualization tools on the interface. In the past two decades, leveraging advanced natural language processing technologies, numerous V-NLI systems have been developed in academic research and commercial software, especially in recent years. In this article, we conduct a comprehensive review of the existing V-NLIs. In order to classify each article, we develop categorical dimensions based on a classic information visualization pipeline with the extension of a V-NLI layer. The following seven stages are used: query interpretation, data transformation, visual mapping, view transformation, human interaction, dialogue management, and?¡­",Conference paper,https://ieeexplore.ieee.org/abstract/document/9699035/,110,shen2022towards,"Data Visualization, Natural Language Interfaces, Survey"
2023,arXiv preprint arXiv:2310.07521,"Survey on factuality in large language models: Knowledge, retrieval and domain-specificity","Cunxiang Wang, Xiaoze Liu, Yuanhao Yue, Xiangru Tang, Tianhang Zhang, Cheng Jiayang, Yunzhi Yao, Wenyang Gao, Xuming Hu, Zehan Qi, Yidong Wang, Linyi Yang, Jindong Wang, Xing Xie, Zheng Zhang, Yue Zhang",Cunxiang Wang,English,"This survey addresses the crucial issue of factuality in Large Language Models (LLMs). As LLMs find applications across diverse domains, the reliability and accuracy of their outputs become vital. We define the Factuality Issue as the probability of LLMs to produce content inconsistent with established facts. We first delve into the implications of these inaccuracies, highlighting the potential consequences and challenges posed by factual errors in LLM outputs. Subsequently, we analyze the mechanisms through which LLMs store and process facts, seeking the primary causes of factual errors. Our discussion then transitions to methodologies for evaluating LLM factuality, emphasizing key metrics, benchmarks, and studies. We further explore strategies for enhancing LLM factuality, including approaches tailored for specific domains. We focus two primary LLM configurations standalone LLMs and Retrieval-Augmented LLMs that utilizes external data, we detail their unique challenges and potential enhancements. Our survey offers a structured guide for researchers aiming to fortify the factual reliability of LLMs.",Article,https://arxiv.org/abs/2310.07521,94,wang2023survey,"Factuality, factuality in LLM, retrieval augmented LLM, domain factuality enhanced LLM"
2020,EMNLP,SelfORE: Self-supervised Relational Feature Learning for Open Relation Extraction,"Xuming Hu, Lijie Wen, Yusong Xu, Chenwei Zhang, Philip S Yu",Xuming Hu,English,"Open relation extraction is the task of extracting open-domain relation facts from natural language sentences. Existing works either utilize heuristics or distant-supervised annotations to train a supervised classifier over pre-defined relations, or adopt unsupervised methods with additional assumptions that have less discriminative power. In this work, we proposed a self-supervised framework named SelfORE, which exploits weak, self-supervised signals by leveraging large pretrained language model for adaptive clustering on contextualized relational features, and bootstraps the self-supervised signals by improving contextualized features in relation classification. Experimental results on three datasets show the effectiveness and robustness of SelfORE on open-domain Relation Extraction when comparing with competitive baselines.",Conference paper,https://arxiv.org/abs/2004.02438,92,hu2020selfore,"?relation extraction,self-supervised,learning"
2023,arXiv preprint arXiv:2303.13547,A comprehensive evaluation of ChatGPT's zero-shot Text-to-SQL capability,"Aiwei Liu, Xuming Hu, Lijie Wen, Philip S Yu",Aiwei Liu,English,"This paper presents the first comprehensive analysis of ChatGPT's Text-to-SQL ability. Given the recent emergence of large-scale conversational language model ChatGPT and its impressive capabilities in both conversational abilities and code generation, we sought to evaluate its Text-to-SQL performance. We conducted experiments on 12 benchmark datasets with different languages, settings, or scenarios, and the results demonstrate that ChatGPT has strong text-to-SQL abilities. Although there is still a gap from the current state-of-the-art (SOTA) model performance, considering that the experiment was conducted in a zero-shot scenario, ChatGPT's performance is still impressive. Notably, in the ADVETA (RPL) scenario, the zero-shot ChatGPT even outperforms the SOTA model that requires fine-tuning on the Spider dataset by 4.1\%, demonstrating its potential for use in practical applications. To support further research in related fields, we have made the data generated by ChatGPT publicly available at https://github.com/THU-BPM/chatgpt-sql.",Article,https://arxiv.org/abs/2303.13547,86,liu2023comprehensive,"ChatGPT,zero-shot,text-to-sql"
2021,EMNLP (Findings),Semi-supervised Relation Extraction via Incremental Meta Self-Training,"Xuming Hu, Fukun Ma, Chenyao Liu, Chenwei Zhang, Lijie Wen, Philip S Yu",Xuming Hu,English,"To alleviate human efforts from obtaining large-scale annotations, Semi-Supervised Relation Extraction methods aim to leverage unlabeled data in addition to learning from limited samples. Existing self-training methods suffer from the gradual drift problem, where noisy pseudo labels on unlabeled data are incorporated during training. To alleviate the noise in pseudo labels, we propose a method called MetaSRE, where a Relation Label Generation Network generates quality assessment on pseudo labels by (meta) learning from the successful and failed attempts on Relation Classification Network as an additional meta-objective. To reduce the influence of noisy pseudo labels, MetaSRE adopts a pseudo label selection and exploitation scheme which assesses pseudo label quality on unlabeled samples and only exploits high-quality pseudo labels in a self-training fashion to incrementally augment labeled samples for both robustness and accuracy. Experimental results on two public datasets demonstrate the effectiveness of the proposed approach.",Article,https://arxiv.org/abs/2010.16410,71,hu2020semi,"Semi-Supervised Relation Extraction,pseudo label,self-training"
2021,EMNLP,Gradient Imitation Reinforcement Learning for Low Resource Relation Extraction,"Xuming Hu, Chenwei Zhang, Yawen Yang, Xiaohe Li, Li Lin, Lijie Wen, Philip S Yu",Xuming Hu,English,"Low-resource Relation Extraction (LRE) aims to extract relation facts from limited labeled corpora when human annotation is scarce. Existing works either utilize self-training scheme to generate pseudo labels that will cause the gradual drift problem, or leverage meta-learning scheme which does not solicit feedback explicitly. To alleviate selection bias due to the lack of feedback loops in existing LRE learning paradigms, we developed a Gradient Imitation Reinforcement Learning method to encourage pseudo label data to imitate the gradient descent direction on labeled data and bootstrap its optimization capability through trial and error. We also propose a framework called GradLRE, which handles two major scenarios in low-resource relation extraction. Besides the scenario where unlabeled data is sufficient, GradLRE handles the situation where no unlabeled data is available, by exploiting a contextualized augmentation method to generate data. Experimental results on two public datasets demonstrate the effectiveness of GradLRE on low resource relation extraction when comparing with baselines.",Article,https://arxiv.org/abs/2109.06415,56,hu2021gradient,"gradient imitation reinforcement learning,reinforcement learning,low resource relation"
2021,arXiv preprint arXiv:2112.02714,CLASSIC: Continual and contrastive learning of aspect sentiment classification tasks,"Zixuan Ke, Bing Liu, Hu Xu, Lei Shu",Zixuan Ke,English,"This paper studies continual learning (CL) of a sequence of aspect sentiment classification(ASC) tasks in a particular CL setting called domain incremental learning (DIL). Each task is from a different domain or product. The DIL setting is particularly suited to ASC because in testing the system needs not know the task/domain to which the test data belongs. To our knowledge, this setting has not been studied before for ASC. This paper proposes a novel model called CLASSIC. The key novelty is a contrastive continual learning method that enables both knowledge transfer across tasks and knowledge distillation from old tasks to the new task, which eliminates the need for task ids in testing. Experimental results show the high effectiveness of CLASSIC.",Article,https://arxiv.org/abs/2112.02714,52,ke2021classic,"aspect sentiment,continual learning,classification"
2024,The Twelfth International Conference on Learning Representations,A Semantic Invariant Robust Watermark for Large Language Models,"A Liu, L Pan, X Hu, S Meng, L Wen",A Liu,English,"This paper studies continual learning (CL) of a sequence of aspect sentiment classification(ASC) tasks in a particular CL setting called domain incremental learning (DIL). Each task is from a different domain or product. The DIL setting is particularly suited to ASC because in testing the system needs not know the task/domain to which the test data belongs. To our knowledge, this setting has not been studied before for ASC. This paper proposes a novel model called CLASSIC. The key novelty is a contrastive continual learning method that enables both knowledge transfer across tasks and knowledge distillation from old tasks to the new task, which eliminates the need for task ids in testing. Experimental results show the high effectiveness of CLASSIC.",Article,https://arxiv.org/abs/2112.02714,38,liu2023semantic,"Watermark algorithms,Large Language Models,Robustness"
2022,ICASSP,Pair-level supervised contrastive learning for natural language inference,"Shuang Li, Xuming Hu, Li Lin, Lijie Wen",Shuang Li,English,"Natural language inference (NLI) is an increasingly important task for natural language understanding, which requires one to infer the relationship between the sentence pair (premise and hypothesis). Many recent works have used contrastive learning by incorporating the relationship of the sentence pair from NLI datasets to learn sentence representation. However, these methods only focus on comparisons with sentence-level representations. In this paper, we propose a Pair-level Supervised Contrastive Learning approach (PairSCL). We adopt a cross attention module to learn the joint representations of the sentence pairs. A contrastive learning objective is designed to distinguish the varied classes of sentence pairs by pulling those in one class together and pushing apart the pairs in other classes. We evaluate PairSCL on two public datasets of NLI where the accuracy of PairSCL outperforms other methods by 2?¡­",Conference paper,https://ieeexplore.ieee.org/abstract/document/9746499/,34,li2022pair,"supervised contrastive learning, natural language inference, pair-level representation"
2022,NAACL,HiURE: Hierarchical Exemplar Contrastive Learning for Unsupervised Relation Extraction,"Shuliang Liu*, Xuming Hu*, Chenwei Zhang, Shuang Li, Lijie Wen, Philip S Yu",Shuliang Liu*,English,"Unsupervised relation extraction aims to extract the relationship between entities from natural language sentences without prior information on relational scope or distribution. Existing works either utilize self-supervised schemes to refine relational feature signals by iteratively leveraging adaptive clustering and classification that provoke gradual drift problems, or adopt instance-wise contrastive learning which unreasonably pushes apart those sentence pairs that are semantically similar. To overcome these defects, we propose a novel contrastive learning framework named HiURE, which has the capability to derive hierarchical signals from relational feature space using cross hierarchy attention and effectively optimize relation representation of sentences under exemplar-wise contrastive learning. Experimental results on two public datasets demonstrate the advanced effectiveness and robustness of HiURE on unsupervised relation extraction when compared with state-of-the-art models.",Article,https://arxiv.org/abs/2205.02225,33,hu2022hiure,"hierarchical exemplar contrastive learning,relation,unsupervised"
2022,NAACL,CHEF: A Pilot Chinese Dataset for Evidence-Based Fact-Checking,"Xuming Hu, Zhijiang Guo, Guanyu Wu, Aiwei Liu, Lijie Wen, Philip S Yu",Xuming Hu,English,"The explosion of misinformation spreading in the media ecosystem urges for automated fact-checking. While misinformation spans both geographic and linguistic boundaries, most work in the field has focused on English. Datasets and tools available in other languages, such as Chinese, are limited. In order to bridge this gap, we construct CHEF, the first CHinese Evidence-based Fact-checking dataset of 10K real-world claims. The dataset covers multiple domains, ranging from politics to public health, and provides annotated evidence retrieved from the Internet. Further, we develop established baselines and a novel approach that is able to model the evidence retrieval as a latent variable, allowing jointly training with the veracity prediction model in an end-to-end fashion. Extensive experiments show that CHEF will provide a challenging testbed for the development of fact-checking systems designed to retrieve and reason over non-English claims.",Article,https://arxiv.org/abs/2206.11863,27,hu2022chef,"Chinese dataset,evidence-based,fact-checking"
2024,ICLR (Spotlight),Do Large Language Models Know about Facts?,"Xuming Hu, Junzhe Chen, Xiaochuan Li, Yufei Guo, Lijie Wen, Philip S Yu, Zhijiang Guo",Xuming Hu,English,"Large language models (LLMs) have recently driven striking performance improvements across a range of natural language processing tasks. The factual knowledge acquired during pretraining and instruction tuning can be useful in various downstream tasks, such as question answering, and language generation. Unlike conventional Knowledge Bases (KBs) that explicitly store factual knowledge, LLMs implicitly store facts in their parameters. Content generated by the LLMs can often exhibit inaccuracies or deviations from the truth, due to facts that can be incorrectly induced or become obsolete over time. To this end, we aim to comprehensively evaluate the extent and scope of factual knowledge within LLMs by designing the benchmark Pinocchio. Pinocchio contains 20K diverse factual questions that span different sources, timelines, domains, regions, and languages. Furthermore, we investigate whether LLMs are able to compose multiple facts, update factual knowledge temporally, reason over multiple pieces of facts, identify subtle factual differences, and resist adversarial examples. Extensive experiments on different sizes and types of LLMs show that existing LLMs still lack factual knowledge and suffer from various spurious correlations. We believe this is a critical bottleneck for realizing trustworthy artificial intelligence. The dataset Pinocchio and our codes will be publicly available.",Article,https://arxiv.org/abs/2310.05177,26,hu2023large,"Large Language Models,Resource and Evaluation,Interpretability,NLP Application"
2022,arXiv preprint arXiv:2210.05549,Continual training of language models for few-shot learning,"Zixuan Ke, Haowei Lin, Yijia Shao, Hu Xu, Lei Shu, Bing Liu",Zixuan Ke,English,"Recent work on applying large language models (LMs) achieves impressive performance in many NLP applications. Adapting or posttraining an LM using an unlabeled domain corpus can produce even better performance for end-tasks in the domain. This paper proposes the problem of continually extending an LM by incrementally post-train the LM with a sequence of unlabeled domain corpora to expand its knowledge without forgetting its previous skills. The goal is to improve the few-shot end-task learning in these domains. The resulting system is called CPT (Continual PostTraining), which to our knowledge, is the first continual post-training system. Experimental results verify its effectiveness.",Article,https://arxiv.org/abs/2210.05549,25,ke2022continual,"language models,learning,training,few-shot"
2022,SIGKDD,Semantic Enhanced Text-to-SQL Parsing via Iteratively Learning Schema Linking Graph,"Aiwei Liu, Xuming Hu, Li Lin, Lijie Wen",Aiwei Liu,English,"The generalizability to new databases is of vital importance to Text-to-SQL systems which aim to parse human utterances into SQL statements. Existing works achieve this goal by leveraging the exact matching method to identify the lexical matching between the question words and the schema items. However, these methods fail in other challenging scenarios, such as the synonym substitution in which the surface form differs between the corresponding question words and schema items. In this paper, we propose a framework named ISESL-SQL to iteratively build a semantic enhanced schema-linking graph between question tokens and database schemas. First, we extract a schema linking graph from PLMs through a probing procedure in an unsupervised manner. Then the schema linking graph is further optimized during the training process through a deep graph learning method. Meanwhile, we also design an?¡­",Article,https://dl.acm.org/doi/abs/10.1145/3534678.3539294,24,liu2022semantic,"Text-to-SQL, Graph neural networks, Model Robustness"
2023,The Twelfth International Conference on Learning Representations,An unforgeable publicly verifiable watermark for large language models,"Aiwei Liu, Leyi Pan, Xuming Hu, Shuang Li, Lijie Wen, Irwin King, S Yu Philip",Aiwei Liu,English,"Recently, text watermarking algorithms for large language models (LLMs) have been proposed to mitigate the potential harms of text generated by LLMs, including fake news and copyright issues. However, current watermark detection algorithms require the secret key used in the watermark generation process, making them susceptible to security breaches and counterfeiting during public detection. To address this limitation, we propose an unforgeable publicly verifiable watermark algorithm named UPV that uses two different neural networks for watermark generation and detection, instead of using the same key at both stages. Meanwhile, the token embedding parameters are shared between the generation and detection networks, which makes the detection network achieve a high accuracy very efficiently. Experiments demonstrate that our algorithm attains high detection accuracy and computational efficiency through neural networks. Subsequent analysis confirms the high complexity involved in forging the watermark from the detection network. Our code is available at https://github.com/THU-BPM/unforgeable_watermark",Conference paper,https://openreview.net/forum?id=gMLQwKDY3N,8,liu2023unforgeable,"Watermark,Large Language Models,Model Security"
2022,EMNLP,Character-level White-Box Adversarial Attacks against Transformers via Attachable Subwords Substitution,"Aiwei Liu, Honghai Yu, Xuming Hu, Shu'ang Li, Li Lin, Fukun Ma, Yawen Yang, Lijie Wen",Aiwei Liu,English,"We propose the first character-level white-box adversarial attack method against transformer models. The intuition of our method comes from the observation that words are split into subtokens before being fed into the transformer models and the substitution between two close subtokens has a similar effect to the character modification. Our method mainly contains three steps. First, a gradient-based method is adopted to find the most vulnerable words in the sentence. Then we split the selected words into subtokens to replace the origin tokenization result from the transformer tokenizer. Finally, we utilize an adversarial loss to guide the substitution of attachable subtokens in which the Gumbel-softmax trick is introduced to ensure gradient propagation. Meanwhile, we introduce the visual and length constraint in the optimization process to achieve minimum character modifications. Extensive experiments on both sentence-level and token-level tasks demonstrate that our method could outperform the previous attack methods in terms of success rate and edit distance. Furthermore, human evaluation verifies our adversarial examples could preserve their origin labels.",Article,https://arxiv.org/abs/2210.17004,22,liu2022character,"Transformers,adversarial attacks,substitution,character-level,white-box"
2022,arXiv preprint arXiv:2202.02529,Graph Neural Network with Curriculum Learning for Imbalanced Node Classification,"Xiaohe Li, Lijie Wen, Yawen Deng, Fuli Feng, Xuming Hu, Lei Wang, Zide Fan",Xiaohe Li,English,"Graph Neural Network (GNN) stands as an emerging methodology for graph-based learning tasks, particularly for node classification. This study elucidates the susceptibility of GNN to discrepancies arising from imbalanced node labels. Conventional solutions for imbalanced classification, such as resampling, falter in node classification task, primarily due to their negligence of graph structure. Worse still, they often exacerbate the model¡¯s inclination towards overfitting or underfitting, especially in the absence of adequate priori knowledge. To circumvent these limitations, we introduce a novel Graph Neural Network framework with Curriculum Learning (GNN-CL). This framework integrates two pivotal components. Initially, leveraging the principles of smoothness and homophily, we endeavor to procure dependable interpolation nodes and edges via adaptive graph oversampling. For another, we combine the Graph?¡­",Article,https://www.sciencedirect.com/science/article/pii/S0925231223013528,23,li2024graph,"Graph neural networks,Imbalanced classification,Curriculum learning"
2023,Proceedings of the 46th international ACM SIGIR conference on research and?¡­,Mr2: A benchmark for multimodal retrieval-augmented rumor detection in social media,"Xuming Hu, Zhijiang Guo, Junzhe Chen, Lijie Wen, Philip S Yu",Xuming Hu,English,"As social media platforms are evolving from text-based forums into multi-modal environments, the nature of misinformation in social media is also transforming accordingly. Misinformation spreaders have recently targeted contextual connections between the modalities e.g., text and image. However, existing datasets for rumor detection mainly focus on a single modality i.e., text. To bridge this gap, we construct MR2, a multimodal multilingual retrieval-augmented dataset for rumor detection. The dataset covers rumors with images and texts, and provides evidence from both modalities that are retrieved from the Internet. Further, we develop established baselines and conduct a detailed analysis of the systems evaluated on the dataset. Extensive experiments show that MR2 will provide a challenging testbed for developing rumor detection systems designed to retrieve and reason over social media posts. Source code?¡­",Conference paper,https://dl.acm.org/doi/abs/10.1145/3539618.3591896,18,hu2023mr2,"Rumor Detection Benchmark, Social Media, Multimodal Retrieval- Augmented Methods"
2022,Transactions on Audio,A Multi-level Supervised Contrastive Learning Framework for Low-Resource Natural Language Inference,"Shu'ang Li, Xuming Hu, Li Lin, Aiwei Liu, Lijie Wen, Philip S Yu",Shu'ang Li,English,"Natural Language Inference (NLI) is a growingly essential task in natural language understanding, which requires inferring the relationship between the sentence pairs ( premise  and  hypothesis ). Recently, low-resource natural language inference has gained increasing attention, due to significant savings in manual annotation costs and a better fit with real-world scenarios. Existing works fail to characterize discriminative representations between different classes with limited training data, which may cause faults in label prediction. Here we propose a multi-level supervised contrastive learning framework named MultiSCL for low-resource natural language inference. MultiSCL leverages a sentence-level and pair-level contrastive learning objective to discriminate between different classes of sentence pairs by bringing those in one class together and pushing away those in different classes. MultiSCL adopts a data?¡­",Article,https://ieeexplore.ieee.org/abstract/document/10109756/,18,hu2023multi,"contrastive learning,multi-level,low-resource,natural language inference"
