Year,Sources,Name,Authors,First Author,Chinese/English,Abstract,Venues,doi,Citation,Id,Keyword
2020,Advances in neural information processing systems 33,Graph random neural networks for semi-supervised learning on graphs,"Wenzheng Feng, Jie Zhang, Yuxiao Dong, Yu Han, Huanbo Luan, Qian Xu, Qiang Yang, Evgeny Kharlamov, Jie Tang",Wenzheng Feng,English,"We study the problem of semi-supervised learning on graphs, for which graph neural networks (GNNs) have been extensively explored. However, most existing GNNs inherently suffer from the limitations of over-smoothing, non-robustness, and weak-generalization when labeled nodes are scarce. In this paper, we propose a simple yet effective framework¡ªGRAPH RANDOM NEURAL NETWORKS (GRAND)¡ªto address these issues. In GRAND, we first design a random propagation strategy to perform graph data augmentation. Then we leverage consistency regularization to optimize the prediction consistency of unlabeled nodes across different data augmentations. Extensive experiments on graph benchmark datasets suggest that GRAND significantly outperforms state-of-the-art GNN baselines on semi-supervised node classification. Finally, we show that GRAND mitigates the issues of over-smoothing and non-robustness, exhibiting better generalization behavior than existing GNNs. The source code of GRAND is publicly available at https://github. com/Grand20/grand.",Article,https://proceedings.neurips.cc/paper_files/paper/2020/hash/fb4c835feb0a65cc39739320d7a51c02-Abstract.html,373,feng2020graph,"graph neural networks,random propagation strategy,graphs"
2021,Journal of Machine Learning Research,Fate: An industrial grade platform for collaborative learning with data protection,"Yang Liu, Tao Fan, Tianjian Chen, Qian Xu, Qiang Yang",Yang Liu,English,"Collaborative and federated learning has become an emerging solution to many industrial applications where data values from different sites are exploit jointly with privacy protection. We introduce FATE, an industrial-grade project that supports enterprises and institutions to build machine learning models collaboratively at large-scale in a distributed manner. FATE supports a variety of secure computation protocols and machine learning algorithms, and features out-of-box usability with end-to-end building modules and visualization tools. Documentations are available at https://github.com/FederatedAI/FATE. Case studies and other information are available at https://www.fedai.org.",Article,https://www.jmlr.org/papers/v22/20-815.html,188,liu2021fate,"federated learning, collaborative learning, secure multi-party computation, data protection, privacy-preserving"
2021,International conference on machine learning,Deep generative learning via schrodinger bridge,"Gefei Wang, Yuling Jiao, Qian Xu, Yang Wang, Can Yang",Gefei Wang,English,"We propose to learn a generative model via entropy interpolation with a Schr {?} dinger Bridge. The generative learning task can be formulated as interpolating between a reference distribution and a target distribution based on the Kullback-Leibler divergence. At the population level, this entropy interpolation is characterized via an SDE on [0, 1] with a time-varying drift term. At the sample level, we derive our Schr {?} dinger Bridge algorithm by plugging the drift term estimated by a deep score estimator and a deep density ratio estimator into the Euler-Maruyama method. Under some mild smoothness assumptions of the target distribution, we prove the consistency of both the score estimator and the density ratio estimator, and then establish the consistency of the proposed Schr {?} dinger Bridge approach. Our theoretical results guarantee that the distribution learned by our approach converges to the target distribution. Experimental results on multimodal synthetic data and benchmark data support our theoretical findings and indicate that the generative model via Schr {?} dinger Bridge is comparable with state-of-the-art GANs, suggesting a new formulation of generative learning. We demonstrate its usefulness in image interpolation and image inpainting.",Conference paper,http://proceedings.mlr.press/v139/wang21l.html,82,wang2021deep,"entropy interpolation,deep generative learning"
2022,Proceedings of the AAAI Conference on Artificial Intelligence,Contribution-aware federated learning for smart healthcare,"Zelei Liu, Yuanyuan Chen, Yansong Zhao, Han Yu, Yang Liu, Renyi Bao, Jinpeng Jiang, Zaiqing Nie, Qian Xu, Qiang Yang",Zelei Liu,English,"Artificial intelligence (AI) is a promising technology to transform the healthcare industry. Due to the highly sensitive nature of patient data, federated learning (FL) is often leveraged to build models for smart healthcare applications. Existing deployed FL frameworks cannot address the key issues of varying data quality and heterogeneous data distributions across multiple institutions in this sector. In this paper, we report our experience developing and deploying the Contribution-Aware Federated Learning (CAFL) framework for smart healthcare. It provides an efficient and accurate approach to fairly evaluate FL participants' contribution to model performance without exposing their private data, and improves the FL model training protocol to allow the best performing intermediate models to be distributed to participants for FL training. Since its deployment in Yidu Cloud Technology Inc. in March 2021, CAFL has served 8 well-established medical institutions in China to build healthcare decision support models. It can perform contribution evaluations 2.84 times faster than the best existing approach, and has improved the average accuracy of the resulting models by 2.62% compared to the previous system (which is significant in industrial settings). To our knowledge, it is the first contribution-aware federated learning successfully deployed in the healthcare industry.",Article,https://ojs.aaai.org/index.php/AAAI/article/view/21505,56,liu2022contribution,"artificial intelligence, federated learning, smart healthcare"
2021,arXiv preprint arXiv:2110.10927,Secureboost+: A high performance gradient boosting tree framework for large scale vertical federated learning,"Weijing Chen, Guoqiang Ma, Tao Fan, Yan Kang, Qian Xu, Qiang Yang",Weijing Chen,English,"Gradient boosting decision tree (GBDT) is a widely used ensemble algorithm in the industry. Its vertical federated learning version, SecureBoost, is one of the most popular algorithms used in cross-silo privacy-preserving modeling. As the area of privacy computation thrives in recent years, demands for large-scale and high-performance federated learning have grown dramatically in real-world applications. In this paper, to fulfill these requirements, we propose SecureBoost+ that is both novel and improved from the prior work SecureBoost. SecureBoost+ integrates several ciphertext calculation optimizations and engineering optimizations. The experimental results demonstrate that Secureboost+ has significant performance improvements on large and high dimensional data sets compared to SecureBoost. It makes effective and efficient large-scale vertical federated learning possible.",Article,https://arxiv.org/abs/2110.10927,38,chen2021secureboost+,"Gradient boosting decision tree,vertical federated learning"
2020,Proceedings of the AAAI conference on artificial intelligence,Joint entity and relation extraction with a hybrid transformer and reinforcement learning based model,"Ya Xiao, Chengxiang Tan, Zhijie Fan, Qian Xu, Wenye Zhu",Ya Xiao,English,"Joint extraction of entities and relations is a task that extracts the entity mentions and semantic relations between entities from the unstructured texts with one single model. Existing entity and relation extraction datasets usually rely on distant supervision methods which cannot identify the corresponding relations between a relation and the sentence, thus suffers from noisy labeling problem. We propose a hybrid deep neural network model to jointly extract the entities and relations, and the model is also capable of filtering noisy data. The hybrid model contains a transformer-based encoding layer, an LSTM entity detection module and a reinforcement learning-based relation classification module. The output of the transformer encoder and the entity embedding generated from the entity detection module are combined as the input state of the reinforcement learning module to improve the relation classification and noisy data filtering. We conduct experiments on the public dataset produced by the distant supervision method to verify the effectiveness of our proposed model. Different experimental results show that our model gains better performance on entity and relation extraction than the compared methods and also has the ability to filter noisy sentences.",Article,https://ojs.aaai.org/index.php/AAAI/article/view/6471,32,xiao2020joint,"Joint extraction,hybrid deep neural network,Transformer,reinforcement learning"
2023,arXiv preprint arXiv:2304.01829,A survey on vertical federated learning: From a layered perspective,"Liu Yang, Di Chai, Junxue Zhang, Yilun Jin, Leye Wang, Hao Liu, Han Tian, Qian Xu, Kai Chen",Liu Yang,English,"Vertical federated learning (VFL) is a promising category of federated learning for the scenario where data is vertically partitioned and distributed among parties. VFL enriches the description of samples using features from different parties to improve model capacity. Compared with horizontal federated learning, in most cases, VFL is applied in the commercial cooperation scenario of companies. Therefore, VFL contains tremendous business values. In the past few years, VFL has attracted more and more attention in both academia and industry. In this paper, we systematically investigate the current work of VFL from a layered perspective. From the hardware layer to the vertical federated system layer, researchers contribute to various aspects of VFL. Moreover, the application of VFL has covered a wide range of areas, e.g., finance, healthcare, etc. At each layer, we categorize the existing work and explore the challenges for the convenience of further research and development of VFL. Especially, we design a novel MOSP tree taxonomy to analyze the core component of VFL, i.e., secure vertical federated machine learning algorithm. Our taxonomy considers four dimensions, i.e., machine learning model (M), protection object (O), security model (S), and privacy-preserving protocol (P), and provides a comprehensive investigation.",Article,https://arxiv.org/abs/2304.01829,21,yang2023survey,"vertical federated learning, survey"
2021,ACM Transactions on Intelligent Systems and Technology (TIST),Industrial federated topic modeling,"Di Jiang, Yongxin Tong, Yuanfeng Song, Xueyang Wu, Weiwei Zhao, Jinhua Peng, Rongzhong Lian, Qian Xu, Qiang Yang",Di Jiang,English,"Probabilistic topic modeling has been applied in a variety of industrial applications. Training a high-quality model usually requires a massive amount of data to provide comprehensive co-occurrence information for the model to learn. However, industrial data such as medical or financial records are often proprietary or sensitive, which precludes uploading to data centers. Hence, training topic models in industrial scenarios using conventional approaches faces a dilemma: A party (i.e., a company or institute) has to either tolerate data scarcity or sacrifice data privacy. In this article, we propose a framework named Industrial Federated Topic Modeling (iFTM), in which multiple parties collaboratively train a high-quality topic model by simultaneously alleviating data scarcity and maintaining immunity to privacy adversaries. iFTM is inspired by federated learning, supports two representative topic models (i.e., Latent?¡­",Article,https://dl.acm.org/doi/abs/10.1145/3418283,16,jiang2021industrial,"Topic models,federated learning, differential privacy"
2021,ACM Transactions on Intelligent Systems and Technology (TIST),"A GDPR-compliant ecosystem for speech recognition with transfer, federated, and evolutionary learning","Di Jiang, Conghui Tan, Jinhua Peng, Chaotao Chen, Xueyang Wu, Weiwei Zhao, Yuanfeng Song, Yongxin Tong, Chang Liu, Qian Xu, Qiang Yang, Li Deng",Di Jiang,English,"Automatic Speech Recognition (ASR) is playing a vital role in a wide range of real-world applications. However, Commercial ASR solutions are typically ¡°one-size-fits-all¡± products and clients are inevitably faced with the risk of severe performance degradation in field test. Meanwhile, with new data regulations such as the European Union¡¯s General Data Protection Regulation (GDPR) coming into force, ASR vendors, which traditionally utilize the speech training data in a centralized approach, are becoming increasingly helpless to solve this problem, since accessing clients¡¯ speech data is prohibited. Here, we show that by seamlessly integrating three machine learning paradigms (i.e., Transfer learning, Federated learning, and Evolutionary learning (TFE)), we can successfully build a win-win ecosystem for ASR clients and vendors and solve all the aforementioned problems plaguing them. Through large-scale?¡­",Article,https://dl.acm.org/doi/abs/10.1145/3447687,12,jiang2021gdpr,"Speech recognition, federated learning, transfer learning, evolutionary learning"
2020,Extended Abstracts of the 2020 CHI Conference on Human Factors in Computing?¡­,"Understanding User Perceptions of Robot's Delay, Voice Quality-Speed Trade-off and GUI during Conversation","Zhenhui Peng, Kaixiang Mo, Xiaogang Zhu, Junlin Chen, Zhijun Chen, Qian Xu, Xiaojuan Ma",Zhenhui Peng,English,"Conversational robots face the practical challenge of providing timely responses to ensure smooth interactions with users. Thus, those who design and implement robots will need to understand how different levels of delay in response may affect users' satisfaction with the conversation, how to balance the trade-off between a robot's quality of voice and response time, and how to design strategies to mitigate possible negative effects of a long delay. Via an online video-prototype study on a service robot with 94 Chinese participants, we find that users could tolerate up to 4s delay but their satisfaction drops at the 8s delay during both information-retrieval conversations and chitchats. We gain an in-depth understanding of users' preference for the trade-off between the voice quality and the response speed, as well as their opinions on possible robot graphic user interface (GUI) design to alleviate negative user?¡­",Conference paper,https://dl.acm.org/doi/abs/10.1145/3334480.3382792,12,peng2020understanding,"Human-Robot Interaction, delay, voice, speech synthesis, graphic user interface"
2021,Journal of Systems Architecture 119,Decentralized and expressive data publish-subscribe scheme in cloud based on attribute-based keyword search,"Qian Xu, Qing Zhang, Bo Yu, Nandi Shi, Changshuai Wang, Wei He",Qian Xu,English,"Data publish-subscribe scheme is a valuable approach to share and retrieve data from cloud platforms selectively. However, the common practice of standard encryption hinders the effective keyword-based data subscription over outsourced data. Attribute-based keyword search (ABKS), which fulfills the functionality of attribute-based encryption and searchable encryption, is a promising cryptographic primitive to construct secure data publish-subscribe scheme. In this paper, for the first time, we propose a decentralized and expressive CP-ABKS scheme with computation outsourcing and collusion resistance. Then we construct a novel data publish-subscribe scheme based on the proposed CP-ABKS to realize secure and flexible data sharing among multiple users. Both the access and subscription policies are expressed with the Linear Secret Sharing Scheme structure that can be derived from any monotonic?¡­",Article,https://www.sciencedirect.com/science/article/pii/S1383762121001892,6,xu2021decentralized,"Data publish-subscribe,Attribute-based keyword search ,Expressive data subscription,Decentralized,Online/offline encryption"
2020,Proceedings of the 28th ACM International Conference on Multimedia,Goldenretriever: A speech recognition system powered by modern information retrieval,"Yuanfeng Song, Di Jiang, Xiaoling Huang, Yawen Li, Qian Xu, Raymond Chi-Wing Wong, Qiang Yang",Yuanfeng Song,English,"Existing Automatic Speech Recognition (ASR) systems usually generate the N-best hypotheses list first, and then rescore them with the language model score and the acoustic model score to find the best one. This procedure is essentially analogous to the working mechanism of modern Information Retrieval (IR) systems, which retrieve a relatively large amount of relevant candidates first, re-rank them, and output the top-N list. Exploiting their commonality, this demonstration proposes a novel system named GoldenRetriever that marries IR with ASR. GoldenRetriever transforms the problem of N-best hypotheses rescoring as a Learning-to-Rescore (L2RS) problem and utilizes a wide range of features beyond the language model score and the acoustic model score. In this demonstration, the audience can experience the great potential of marrying IR with ASR for the first time. GoldenRetriever should inspire more?¡­",Conference paper,https://dl.acm.org/doi/abs/10.1145/3394171.3414392,6,song2020goldenretriever,"N-best rescoring, learning-to-rescore, speech recognition"
2022,arXiv preprint arXiv:2206.13398,An efficient industrial federated learning framework for AIoT: a face recognition application,"Youlong Ding, Xueyang Wu, Zhitao Li, Zeheng Wu, Shengqi Tan, Qian Xu, Weike Pan, Qiang Yang",Youlong Ding,English,"Recently, the artificial intelligence of things (AIoT) has been gaining increasing attention, with an intriguing vision of providing highly intelligent services through the network connection of things, leading to an advanced AI-driven ecology. However, recent regulatory restrictions on data privacy preclude uploading sensitive local data to data centers and utilizing them in a centralized approach. Directly applying federated learning algorithms in this scenario could hardly meet the industrial requirements of both efficiency and accuracy. Therefore, we propose an efficient industrial federated learning framework for AIoT in terms of a face recognition application. Specifically, we propose to utilize the concept of transfer learning to speed up federated training on devices and further present a novel design of a private projector that helps protect shared gradients without incurring additional memory consumption or computational cost. Empirical studies on a private Asian face dataset show that our approach can achieve high recognition accuracy in only 20 communication rounds, demonstrating its effectiveness in prediction and its efficiency in training.",Article,https://arxiv.org/abs/2206.13398,6,ding2022efficient,"artificial intelligence of things (AIoT),federated learning, face recognition, transfer learning"
2021,Proceedings of the Twenty-Ninth International Conference on International?¡­,A de novo divide-and-merge paradigm for acoustic model optimization in automatic speech recognition,"Conghui Tan, Di Jiang, Jinhua Peng, Xueyang Wu, Qian Xu, Qiang Yang",Conghui Tan,English,"Due to the rising awareness of privacy protection and the voluminous scale of speech data, it is becoming infeasible for Automatic Speech Recognition (ASR) system developers to train the acoustic model with complete data as before. In this paper, we propose a novel Divide-and-Merge paradigm to solve salient problems plaguing the ASR field. In the Divide phase, multiple acoustic models are trained based upon different subsets of the complete speech data, while in the Merge phase two novel algorithms are utilized to generate a highquality acoustic model based upon those trained on data subsets. We first propose the Genetic Merge Algorithm (GMA), which is a highly specialized algorithm for optimizing acoustic models but suffers from low efficiency. We further propose the SGD-Based Optimizational Merge Algorithm (SOMA), which effectively alleviates the efficiency bottleneck of GMA and maintains superior performance. Extensive experiments on public data show that the proposed methods can significantly outperform the state-of-the-art.",Conference paper,https://www.ijcai.org/proceedings/2020/0513.pdf,5,tan2021novo,"Automatic Speech Recognition (ASR), acoustic model, Divide-and-Merge paradigm"
2020,Database Systems for Advanced Applications: 25th International Conference?¡­,Federated acoustic model optimization for automatic speech recognition,"Conghui Tan, Di Jiang, Huaxiao Mo, Jinhua Peng, Yongxin Tong, Weiwei Zhao, Chaotao Chen, Rongzhong Lian, Yuanfeng Song, Qian Xu",Conghui Tan,English," Traditional Automatic Speech Recognition (ASR) systems are usually trained with speech records centralized on the ASR vendor¡¯s machines. However, with data regulations such as General Data Protection Regulation (GDPR) coming into force, sensitive data such as speech records are not allowed to be utilized in such a centralized approach anymore. In this demonstration, we propose and show the method of federated acoustic model optimization in order to solve this problem. This demonstration does not only vividly show the underlying working mechanisms of the proposed method but also provides an interface for the user to customize its hyperparameters. With this demonstration, the audience can experience the effect of federated learning in an interactive fashion and we wish this demonstration would inspire more research on GDPR-compliant ASR technologies.",Conference paper,https://link.springer.com/chapter/10.1007/978-3-030-59419-0_54,5,tan2020federated,"federated learning, speech recognition, adaptive training, LVCSR, GDPR"
2020,CoRR,Graph random neural network,"Wenzheng Feng, Jie Zhang, Yuxiao Dong, Yu Han, Huanbo Luan, Qian Xu, Qiang Yang, Jie Tang",Wenzheng Feng,English,"Graph neural networks (GNNs) have generalized deep learning methods into graph-structured data with promising performance on graph mining tasks. However, existing GNNs often meet complex graph structures with scarce labeled nodes and suffer from the limitations of non-robustness [51, 53], over-smoothing [8, 29, 30], and overfitting [19, 30]. To address these issues, we propose a simple yet effective GNN framework¡ªGraph Random Neural Network (Grand). Different from the deterministic propagation in existing GNNs, Grand adopts a random propagation strategy to enhance model robustness. This strategy also naturally enables Grand to decouple the propagation from feature transformation, reducing the risks of over-smoothing and overfitting. Moreover, random propagation acts as an efficient method for graph data augmentation. Based on this, we propose the consistency regularization for Grand by leveraging the distributional consistency of unlabeled nodes in multiple augmentations, improving the generalization capacity of the model. Extensive experiments on graph benchmark datasets suggest that Grand significantly outperforms state-of-the-art GNN baselines on semi-supervised graph learning tasks. Finally, we show that Grand mitigates the issues of over-smoothing and overfitting, and its performance is married with robustness.",Article,https://static.aminer.cn/storage/pdf/arxiv/20/2005/2005.11079.pdf,5,feng2020graph,"graph neural networks,deep learning,random propagation strategy"
2023,Proceedings of the AAAI Conference on Artificial Intelligence,FedNP: Towards non-IID federated learning via federated neural propagation,"Xueyang Wu, Hengguan Huang, Youlong Ding, Hao Wang, Ye Wang, Qian Xu",Xueyang Wu,English,"Traditional federated learning (FL) algorithms, such as FedAvg, fail to handle non-iid data because they learn a global model by simply averaging biased local models that are trained on non-iid local data, therefore failing to model the global data distribution. In this paper, we present a novel Bayesian FL algorithm that successfully handles such a non-iid FL setting by enhancing the local training task with an auxiliary task that explicitly estimates the global data distribution. One key challenge in estimating the global data distribution is that the data are partitioned in FL, and therefore the ground-truth global data distribution is inaccessible. To address this challenge, we propose an expectation-propagation-inspired probabilistic neural network, dubbed federated neural propagation (FedNP), which efficiently estimates the global data distribution given non-iid data partitions. Our algorithm is sampling-free and end-to-end differentiable, can be applied with any conventional FL frameworks and learns richer global data representation. Experiments on both image classification tasks with synthetic non-iid image data partitions and real-world non-iid speech recognition tasks demonstrate that our framework effectively alleviates the performance deterioration caused by non-iid data.",Article,https://ojs.aaai.org/index.php/AAAI/article/view/26237,4,wu2023fednp,"federated learning,data distribution, federated neural propagation"
