Year,Sources,Name,Authors,First Author,Chinese/English,Abstract,Venues,doi,Citation,Id,Keywords
2022,ICML,Rethinking Graph Neural Networks for Anomaly Detection,"Jianheng Tang, Jiajin Li, Ziqi Gao, Jia Li",Jianheng Tang,English,"Graph Neural Networks (GNNs) are widely applied for graph anomaly detection. As one of the key components for GNN design is to select a tailored spectral filter, we take the first step towards analyzing anomalies via the lens of the graph spectrum. Our crucial observation is the existence of anomalies will lead to the ‘right-shift’phenomenon, that is, the spectral energy distribution concentrates less on low frequencies and more on high frequencies. This fact motivates us to propose the Beta Wavelet Graph Neural Network (BWGNN). Indeed, BWGNN has spectral and spatial localized band-pass filters to better handle the ‘right-shift’phenomenon in anomalies. We demonstrate the effectiveness of BWGNN on four large-scale anomaly detection datasets. Our code and data are released at https://github. com/squareRoot3/Rethinking-Anomaly-Detection.",Article,https://proceedings.mlr.press/v162/tang22b.html,133,tang2022rethinking,"graph neural networks,anomaly detection"
2020,Proceedings of The Web Conference 2020,Adversarial attack on community detection by hiding individuals,"Jia Li, Honglei Zhang, Zhichao Han, Yu Rong, Hong Cheng, Junzhou Huang",Jia Li,English,"It has been demonstrated that adversarial graphs, i.e., graphs with imperceptible perturbations added, can cause deep graph models to fail on node/graph classification tasks. In this paper, we extend adversarial graphs to the problem of community detection which is much more difficult. We focus on black-box attack and aim to hide targeted individuals from the detection of deep graph community detection models, which has many applications in real-world scenarios, for example, protecting personal privacy in social networks and understanding camouflage patterns in transaction networks. We propose an iterative learning framework that takes turns to update two modules: one working as the constrained graph generator and the other as the surrogate community detection model. We also find that the adversarial graphs generated by our method can be transferred to other learning based community detection models. ",Conference paper,https://dl.acm.org/doi/abs/10.1145/3366423.3380171,87,li2020adversarial,"adversarial attack, community detection, graph generation"
2023,KDD 2023,All in One: Multi-Task Prompting for Graph Neural Networks,"Xiangguo Sun, Hong Cheng, Jia Li, Bo Liu, Jihong Guan",Xiangguo Sun,English,"Recently, ""pre-training and fine-tuning'' has been adopted as a standard workflow for many graph tasks since it can take general graph knowledge to relieve the lack of graph annotations from each application. However, graph tasks with node level, edge level, and graph level are far diversified, making the pre-training pretext often incompatible with these multiple tasks. This gap may even cause a ""negative transfer'' to the specific application, leading to poor results. Inspired by the prompt learning in natural language processing (NLP), which has presented significant effectiveness in leveraging prior knowledge for various NLP tasks, we study the prompting topic for graphs with the motivation of filling the gap between pre-trained models and various graph tasks. In this paper, we propose a novel multi-task prompting method for graph models. Specifically, we first unify the format of graph prompts and language?…",Conference paper,https://dl.acm.org/doi/abs/10.1145/3580305.3599256,60,sun2023all,"pretraining, prompt tuning, graph neural networks"
2023,Nature Communications,Hierarchical graph learning for protein–protein interaction,"Ziqi Gao, Chenran Jiang, Jiawen Zhang, Xiaosen Jiang, Lanqing Li, Peilin Zhao, Huanming Yang, Yong Huang, Jia Li",Ziqi Gao,English,"Protein-Protein Interactions (PPIs) are fundamental means of functions and signalings in biological systems. The massive growth in demand and cost associated with experimental PPI studies calls for computational tools for automated prediction and understanding of PPIs. Despite recent progress, in silico methods remain inadequate in modeling the natural PPI hierarchy. Here we present a double-viewed hierarchical graph learning model, HIGH-PPI, to predict PPIs and extrapolate the molecular details involved. In this model, we create a hierarchical graph, in which a node in the PPI network (top outside-of-protein view) is a protein graph (bottom inside-of-protein view). In the bottom view, a group of chemically relevant descriptors, instead of the protein sequences, are used to better capture the structure-function relationship of the protein. HIGH-PPI examines both outside-of-protein and inside-of-protein of the?…",Article,https://www.nature.com/articles/s41467-023-36736-1,57,gao2023hierarchical,"graph algorithms, large language models, instruction tuning"
2020,NeurIPS 33,Dirichlet graph variational autoencoder,"Jia Li, Jianwei Yu, Jiajin Li, Honglei Zhang, Kangfei Zhao, Yu Rong, Hong Cheng, Junzhou Huang",Jia Li,English,"Graph Neural Networks (GNN) and Variational Autoencoders (VAEs) have been widely used in modeling and generating graphs with latent factors. However there is no clear explanation of what these latent factors are and why they perform well. In this work, we present Dirichlet Graph Variational Autoencoder (DGVAE) with graph cluster memberships as latent factors. Our study connects VAEs based graph generation and balanced graph cut, and provides a new way to understand and improve the internal mechanism of VAEs based graph generation. Specifically, we first interpret the reconstruction term of DGVAE as balanced graph cut in a principled way. Furthermore, motivated by the low pass characteristics in balanced graph cut, we propose a new variant of GNN named Heatts to encode the input graph into cluster memberships. Heatts utilizes the Taylor series for fast computation of Heat kernels and has better low pass characteristics than Graph Convolutional Networks (GCN). Through experiments on graph generation and graph clustering, we demonstrate the effectiveness of our proposed framework.",Article,https://proceedings.neurips.cc/paper_files/paper/2020/hash/38a77aa456fc813af07bb428f2363c8d-Abstract.html,45,li2020dirichlet,"variational autoencoders, topic models, Dirichlet distribution, reparameterization, generative models"
2023,EMNLP Findings,Large Language Models Meet Harry Potter: A Bilingual Dataset for Aligning Dialogue Agents with Characters,"Nuo Chen, Yan Wang, Haiyun Jiang, Deng Cai, Yuhan Li, Ziyang Chen, Longyue Wang, Jia Li",Nuo Chen,English,"In recent years, Dialogue-style Large Language Models (LLMs) such as ChatGPT and GPT4 have demonstrated immense potential in constructing open-domain dialogue agents. However, aligning these agents with specific characters or individuals remains a considerable challenge due to the complexities of character representation and the lack of comprehensive annotations. In this paper, we introduce the Harry Potter Dialogue (HPD) dataset, designed to advance the study of dialogue agents and character alignment. The dataset encompasses all dialogue sessions (in both English and Chinese) from the Harry Potter series and is annotated with vital background information, including dialogue scenes, speakers, character relationships, and attributes. These extensive annotations may empower LLMs to unlock character-driven dialogue capabilities. Furthermore, it can serve as a universal benchmark for evaluating how well can a LLM aligning with a specific character. We benchmark LLMs on HPD using both fine-tuning and in-context learning settings. Evaluation results reveal that although there is substantial room for improvement in generating high-quality, character-aligned responses, the proposed dataset is valuable in guiding models toward responses that better align with the character of Harry Potter.",Article,https://arxiv.org/abs/2211.06869,15,chen2022large,"Imbalanced Learning, Long-tailed Learning, AI for Drug Discovery, Deep Learning Benchmark"
2023,IJCAI 2024,A survey of graph meets large language model: Progress and future directions,"Yuhan Li, Zhixun Li, Peisong Wang, Jia Li, Xiangguo Sun, Hong Cheng, Jeffrey Xu Yu",Yuhan Li,English,"Graph plays a significant role in representing and analyzing complex relationships in real-world applications such as citation networks, social networks, and biological data. Recently, Large Language Models (LLMs), which have achieved tremendous success in various domains, have also been leveraged in graph-related tasks to surpass traditional Graph Neural Networks (GNNs) based methods and yield state-of-the-art performance. In this survey, we first present a comprehensive review and analysis of existing methods that integrate LLMs with graphs. First of all, we propose a new taxonomy, which organizes existing methods into three categories based on the role (i.e., enhancer, predictor, and alignment component) played by LLMs in graph-related tasks. Then we systematically survey the representative methods along the three categories of the taxonomy. Finally, we discuss the remaining limitations of existing studies and highlight promising avenues for future research. The relevant papers are summarized and will be consistently updated at: https://github.com/yhLeeee/Awesome-LLMs-in-Graph-tasks.",Conference paper,https://arxiv.org/abs/2311.12399,19,li2023survey,"large language models, graph neural networks"
2021,NeurIPS 34,Deconvolutional Networks on Graph Data,"Jia Li, Jiajin Li, Yang Liu, Jianwei Yu, Yueting Li, Hong Cheng",Jia Li,English,"In this paper, we consider an inverse problem in graph learning domain--"" given the graph representations smoothed by Graph Convolutional Network (GCN), how can we reconstruct the input graph signal?"" We propose Graph Deconvolutional Network (GDN) and motivate the design of GDN via a combination of inverse filters in spectral domain and de-noising layers in wavelet domain, as the inverse operation results in a high frequency amplifier and may amplify the noise. We demonstrate the effectiveness of the proposed method on several tasks including graph feature imputation and graph structure generation.",Article,https://proceedings.neurips.cc/paper/2021/hash/afa299a4d1d8c52e75dd8a24c3ce534f-Abstract.html,23,li2021deconvolutional,"graph convolutional networks,graph deconvolutional networks"
2023,IEEE Transactions on Knowledge and Data Engineering,Self-supervised hypergraph representation learning for sociological analysis,"Xiangguo Sun, Hong Cheng, Bo Liu, Jia Li, Hongyang Chen, Guandong Xu, Hongzhi Yin",Xiangguo Sun,English,"Modern sociology has profoundly uncovered many convincing social criteria for behavioral analysis. Unfortunately, many of them are too subjective to be measured and very challenging to be presented in online social networks (OSNs) for the large data volume and complicated environments to be explored. On the other hand, data mining techniques can better find data patterns but many of them leave behind unnatural understanding to humans. Although there are some works trying to integrate social observations for specific tasks, they are still hard to be applied to more general cases. In this paper, we propose a fundamental methodology to support the further fusion of data mining techniques and sociological behavioral criteria. Our highlights are three-fold: First, we propose an effective hypergraph awareness and a fast line graph construction framework. The hypergraph can more profoundly indicate the?…",Article,https://ieeexplore.ieee.org/abstract/document/10040228/,25,sun2023self,"hypergraph, social conformity, social influence, self-supervised learning"
2022,IEEE Transactions on Pattern Analysis and Machine Intelligence,Semi-supervised hierarchical graph classification,"Jia Li, Yongfeng Huang, Heng Chang, Yu Rong",Jia Li,English,"Node classification and graph classification are two graph learning problems that predict the class label of a node and the class label of a graph respectively. A node of a graph usually represents a real-world entity, e.g., a user in a social network, or a document in a document citation network. In this work, we consider a more challenging but practically useful setting, in which a node itself is a graph instance. This leads to a hierarchical graph perspective which arises in many domains such as social network, biological network and document collection. We study the node classification problem in the hierarchical graph where a “node” is a graph instance. As labels are usually limited, we design a novel semi-supervised solution named SEAL-CI. SEAL-CI adopts an iterative framework that takes turns to update two modules, one working at the graph instance level and the other at the hierarchical graph level. To enforce?…",Article,https://ieeexplore.ieee.org/abstract/document/9875050/,19,li2022semi,"graph representation, graph mutual information, hierarchical graph, semi-supervised learning"
2023,arXiv preprint arXiv:2311.16534,Graph prompt learning: A comprehensive survey and beyond,"Xiangguo Sun, Jiawen Zhang, Xixi Wu, Hong Cheng, Yun Xiong, Jia Li",Xiangguo Sun,English,"Artificial General Intelligence (AGI) has revolutionized numerous fields, yet its integration with graph data, a cornerstone in our interconnected world, remains nascent. This paper presents a pioneering survey on the emerging domain of graph prompts in AGI, addressing key challenges and opportunities in harnessing graph data for AGI applications. Despite substantial advancements in AGI across natural language processing and computer vision, the application to graph data is relatively underexplored. This survey critically evaluates the current landscape of AGI in handling graph data, highlighting the distinct challenges in cross-modality, cross-domain, and cross-task applications specific to graphs. Our work is the first to propose a unified framework for understanding graph prompt learning, offering clarity on prompt tokens, token structures, and insertion patterns in the graph domain. We delve into the intrinsic properties of graph prompts, exploring their flexibility, expressiveness, and interplay with existing graph models. A comprehensive taxonomy categorizes over 100 works in this field, aligning them with pre-training tasks across node-level, edge-level, and graph-level objectives. Additionally, we present, ProG, a Python library, and an accompanying website, to support and advance research in graph prompting. The survey culminates in a discussion of current challenges and future directions, offering a roadmap for research in graph prompting within AGI. Through this comprehensive analysis, we aim to catalyze further exploration and practical applications of AGI in graph data, underlining its potential to reshape AGI fields and beyond. ProG?…",Conference paper,https://arxiv.org/abs/2311.16534,19,sun2023graph,"graph prompt, graph pre-training, graph learning, artificial general intelligence"
2023,NeurIPS 2023,GADBench: Revisiting and Benchmarking Supervised Graph Anomaly Detection,"Jianheng Tang, Fengrui Hua, Ziqi Gao, Peilin Zhao, Jia Li",Jianheng Tang,English,"With a long history of traditional Graph Anomaly Detection (GAD) algorithms and recently popular Graph Neural Networks (GNNs), it is still not clear (1) how they perform under a standard comprehensive setting,(2) whether GNNs can outperform traditional algorithms such as tree ensembles, and (3) how about their efficiency on large-scale graphs. In response, we introduce GADBench---a benchmark tool dedicated to supervised anomalous node detection in static graphs. GADBench facilitates a detailed comparison across 29 distinct models on ten real-world GAD datasets, encompassing thousands to millions (~ 6M) nodes. Our main finding is that tree ensembles with simple neighborhood aggregation can outperform the latest GNNs tailored for the GAD task. We shed light on the current progress of GAD, setting a robust groundwork for subsequent investigations in this domain. GADBench is open-sourced at https://github. com/squareRoot3/GADBench.",Article,https://proceedings.neurips.cc/paper_files/paper/2023/hash/5eaafd67434a4cfb1cf829722c65f184-Abstract-Datasets_and_Benchmarks.html,17,tang2024gadbench,"graph neural networks,graph anomaly detection"
2023,arXiv preprint arXiv:2310.20246,Breaking language barriers in multilingual mathematical reasoning: Insights and observations,"Nuo Chen, Zinan Zheng, Ning Wu, Linjun Shou, Ming Gong, Yangqiu Song, Dongmei Zhang, Jia Li",Nuo Chen,English,"Existing research predominantly focuses on developing powerful language learning models (LLMs) for mathematical reasoning within monolingual languages, with few explorations in preserving efficacy in a multilingual context. To bridge this gap, this paper pioneers exploring and training powerful Multilingual Math Reasoning (xMR) LLMs. Firstly, by utilizing translation, we construct the first multilingual math reasoning instruction dataset, MGSM8KInstruct, encompassing ten distinct languages, thus addressing the issue of training data scarcity in xMR tasks. Based on the collected dataset, we propose different training strategies to build powerful xMR LLMs, named MathOctopus, notably outperform conventional open-source LLMs and exhibit superiority over ChatGPT in few-shot scenarios. Notably, MathOctopus-13B reaches 47.6% accuracy which exceeds ChatGPT 46.3% on MGSM testset. Beyond remarkable results, we unearth several pivotal observations and insights from extensive experiments: (1) When extending the rejection sampling strategy to the multilingual context, it proves effective for model performances, albeit limited. (2) Employing parallel corpora for math Supervised Fine-Tuning (SFT) across multiple languages not only significantly enhances model performance multilingually but also elevates their monolingual performance. This indicates that crafting multilingual corpora can be regarded as a vital strategy for enhancing model performance in a specific language, especially in mathematical reasoning tasks. For instance, MathOctopus-7B improves its counterparts that trained on English from 42.2% to 50.8% on GSM8K testset.",Article,https://arxiv.org/abs/2310.20246,14,chen2023breaking,"large language models,Multilingual Math Reasoning"
2023,ICLR 2023,A Convergent Single-Loop Algorithm for Relaxation of Gromov-Wasserstein in Graph Data,"Jiajin Li, Jianheng Tang, Lemin Kong, Huikang Liu, Jia Li, Anthony Man-Cho So, Jose Blanchet",Jiajin Li,English,"In this work, we present the Bregman Alternating Projected Gradient (BAPG) method, a single-loop algorithm that offers an approximate solution to the Gromov-Wasserstein (GW) distance. We introduce a novel relaxation technique that balances accuracy and computational efficiency, albeit with some compromises in the feasibility of the coupling map. Our analysis is based on the observation that the GW problem satisfies the Luo-Tseng error bound condition, which relates to estimating the distance of a point to the critical point set of the GW problem based on the optimality residual. This observation allows us to provide an approximation bound for the distance between the fixed-point set of BAPG and the critical point set of GW. Moreover, under a mild technical assumption, we can show that BAPG converges to its fixed point set. The effectiveness of BAPG has been validated through comprehensive numerical experiments in graph alignment and partition tasks, where it outperforms existing methods in terms of both solution quality and wall-clock time.",Article,https://arxiv.org/abs/2303.06595,12,li2023convergent,"Time Series, Co-training, Contrastive Learning, Noisy Data"
2023,AAAI 2023,Wiener Graph Deconvolutional Network Improves Graph Self-Supervised Learning,"Jiashun Cheng, Man Li, Jia Li, Fugee Tsung",Jiashun Cheng,English,"Graph self-supervised learning (SSL) has been vastly employed to learn representations from unlabeled graphs. Existing methods can be roughly divided into predictive learning and contrastive learning, where the latter one attracts more research attention with better empirical performance. We argue that, however, predictive models weaponed with powerful decoder could achieve comparable or even better representation power than contrastive models. In this work, we propose a Wiener Graph Deconvolutional Network (WGDN), an augmentation-adaptive decoder empowered by graph wiener filter to perform information reconstruction. Theoretical analysis proves the superior reconstruction ability of graph wiener filter. Extensive experimental results on various datasets demonstrate the effectiveness of our approach.",Article,https://ojs.aaai.org/index.php/AAAI/article/view/25870,12,cheng2023wiener,"graph deconvolutional networks,Self-Supervised Learning"
2022,AAAI 2023,Handling Missing Data via Max-Entropy Regularized Graph Autoencoder,"Ziqi Gao, Yifan Niu, Jiashun Cheng, Jianheng Tang, Tingyang Xu, Peilin Zhao, Lanqing Li, Fugee Tsung, Jia Li",Ziqi Gao,English,"Graph neural networks (GNNs) are popular weapons for modeling relational data. Existing GNNs are not specified for attribute-incomplete graphs, making missing attribute imputation a burning issue. Until recently, many works notice that GNNs are coupled with spectral concentration, which means the spectrum obtained by GNNs concentrates on a local part in spectral domain, eg, low-frequency due to oversmoothing issue. As a consequence, GNNs may be seriously flawed for reconstructing graph attributes as graph spectral concentration tends to cause a low imputation precision. In this work, we present a regularized graph autoencoder for graph attribute imputation, named MEGAE, which aims at mitigating spectral concentration problem by maximizing the graph spectral entropy. Notably, we first present the method for estimating graph spectral entropy without the eigen-decomposition of Laplacian matrix and provide the theoretical upper error bound. A maximum entropy regularization then acts in the latent space, which directly increases the graph spectral entropy. Extensive experiments show that MEGAE outperforms all the other state-of-the-art imputation methods on a variety of benchmark datasets.",Article,https://ojs.aaai.org/index.php/AAAI/article/view/25928,11,gao2023handling,"Graph AutoEncoder,graph neural networks"
2023,ACL 2023,Alleviating Over-smoothing for Unsupervised Sentence Representation,"Nuo Chen, Linjun Shou, Ming Gong, Jian Pei, Bowen Cao, Jianhui Chang, Daxin Jiang, Jia Li",Nuo Chen,English,"Currently, learning better unsupervised sentence representations is the pursuit of many natural language processing communities. Lots of approaches based on pre-trained language models (PLMs) and contrastive learning have achieved promising results on this task. Experimentally, we observe that the over-smoothing problem reduces the capacity of these powerful PLMs, leading to sub-optimal sentence representations. In this paper, we present a Simple method named Self-Contrastive Learning (SSCL) to alleviate this issue, which samples negatives from PLMs intermediate layers, improving the quality of the sentence representation. Our proposed method is quite simple and can be easily extended to various state-of-the-art models for performance boosting, which can be seen as a plug-and-play contrastive framework for learning unsupervised sentence representation. Extensive results prove that SSCL brings the superior performance improvements of different strong baselines (e.g., BERT and SimCSE) on Semantic Textual Similarity and Transfer datasets. Our codes are available at https://github.com/nuochenpku/SSCL.",Article,https://arxiv.org/abs/2305.06154,9,chen2023alleviating,"sentence representation,pre-trained language models"
2023,ICDE 2023,Robust attributed graph alignment via joint structure learning and optimal transport,"Jianheng Tang, Weiqi Zhang, Jiajin Li, Kangfei Zhao, Fugee Tsung, Jia Li",Jianheng Tang,English,"Graph alignment, which aims at identifying corresponding entities across multiple networks, has been widely applied in various domains. As the graphs to be aligned are usually constructed from different sources, the inconsistency issues of structures and features between two graphs are ubiquitous in real-world applications. Most existing methods follow the ""embed-then-cross-compare"" paradigm which computes node embeddings in each graph and then processes node correspondences based on cross-graph embedding comparison. However, we find these methods are unstable and sub-optimal when structure or feature inconsistency appears. To this end, we propose SLOTAlign, an unsupervised graph alignment framework that jointly performs Structure Learning and Optimal Transport Alignment. We convert graph alignment to an optimal transport problem between two intra-graph matrices without the?…",Article,https://ieeexplore.ieee.org/abstract/document/10184815/,11,tang2023robust,"Graph alignment, Unsupervised learning, Structure learning, Optimal transport"
