Year,Sources,Name,Authors,First Author,Chinese/English,Abstract,Venues,doi,Citation,Id,Keywords
2024,arXiv preprint arXiv:2402.11235,ZeroG: Investigating Cross-dataset Zero-shot Transferability in Graphs,"Yuhan Li, Peisong Wang, Zhixun Li, Jeffrey Xu Yu, Jia Li",Yuhan Li,English,"With the development of foundation models such as large language models, zero-shot transfer learning has become increasingly significant. This is highlighted by the generative capabilities of NLP models like GPT-4, and the retrieval-based approaches of CV models like CLIP, both of which effectively bridge the gap between seen and unseen data. In the realm of graph learning, the continuous emergence of new graphs and the challenges of human labeling also amplify the necessity for zero-shot transfer learning, driving the exploration of approaches that can generalize across diverse graph data without necessitating dataset-specific and label-specific fine-tuning. In this study, we extend such paradigms to zero-shot transferability in graphs by introducing ZeroG, a new framework tailored to enable cross-dataset generalization. Addressing the inherent challenges such as feature misalignment, mismatched label spaces, and negative transfer, we leverage a language model to encode both node attributes and class semantics, ensuring consistent feature dimensions across datasets. We also propose a prompt-based subgraph sampling module that enriches the semantic information and structure information of extracted subgraphs using prompting nodes and neighborhood aggregation, respectively. We further adopt a lightweight fine-tuning strategy that reduces the risk of overfitting and maintains the zero-shot learning efficacy of the language model. The results underscore the effectiveness of our model in achieving significant cross-dataset zero-shot transferability, opening pathways for the development of graph foundation models. Especially?…",Article,https://arxiv.org/abs/2402.11235,0,li2024zerog,"Graph alignment, Unsupervised learning, Structure learning, Optimal transport"
2024,arXiv preprint arXiv:2401.02290,Path-based Explanation for Knowledge Graph Completion,"Heng Chang, Jiangnan Ye, Alejo Lopez Avila, Jinhua Du, Jia Li",Heng Chang,English,"Graph Neural Networks (GNNs) have achieved great success in Knowledge Graph Completion (KGC) by modelling how entities and relations interact in recent years. However, the explanation of the predicted facts has not caught the necessary attention. Proper explanations for the results of GNN-based KGC models increase model transparency and help researchers develop more reliable models. Existing practices for explaining KGC tasks rely on instance/subgraph-based approaches, while in some scenarios, paths can provide more user-friendly and interpretable explanations. Nonetheless, the methods for generating path-based explanations for KGs have not been well-explored. To address this gap, we propose Power-Link, the first path-based KGC explainer that explores GNN-based models. We design a novel simplified graph-powering technique, which enables the generation of path-based explanations with a fully parallelisable and memory-efficient training scheme. We further introduce three new metrics for quantitative evaluation of the explanations, together with a qualitative human evaluation. Extensive experiments demonstrate that Power-Link outperforms the SOTA baselines in interpretability, efficiency, and scalability.",Article,https://arxiv.org/abs/2401.02290,0,chang2024path,"Graph Neural Networks, Knowledge Graph Completion, Model Transparency, Model Explanation"
2023,None,Hierarchical Graph Latent Diffusion Model for Molecule Generation,"Tian Bian, Yifan Niu, Heng Chang, Divin Yan, Tingyang Xu, Yu Rong, Jia Li, Hong Cheng",Tian Bian,English,"Recently, generative models based on the diffusion process have emerged as a promising direction for automating the design of molecules. However, directly adding continuous Gaussian noise to discrete graphs leads to the problem of the final noisy data not conforming to the standard Gaussian distribution. Current graph diffusion models either corrupt discrete data through a transition matrix or relax the discrete data to continuous space for the diffusion process. These approaches not only require significant computation resources due to the inclusion of the bond type matrix but also cannot easily perform scalable conditional generation, such as adding cross-attention layers, due to the lack of embedding representations. In this paper, we first introduce the Graph Latent Diffusion Model (GLDM), a novel variant of latent diffusion models that overcomes the mismatch problem of continuous diffusion space and discrete data space. Meanwhile, the latent diffusion framework avoids the issues of computational resource consumption and lack of embeddings for conditional generation faced by current graph diffusion models. However, it only utilizes graph-level embeddings for molecule generation, losing node-level and structural information. Therefore, we further ex- tend the GLDM to the Hierarchical Graph Latent Diffusion Model (HGLDM). By including node embeddings and subgraph embeddings that contain structural in- formation, our model significantly reduces computation time compared to the cur- rent graph diffusion models. We evaluate our model on three benchmarks through unconditional generation and conditional generation tasks, which?…",Conference paper,https://openreview.net/forum?id=RSincg5RBe,0,bianhierarchical,"Hierarchical Graph Latent Diffusion, Molecule Generation"
2023,None,Trading-off Multiple Properties for Molecular Optimization,"Yifan Niu, Ziqi Gao, Tingyang Xu, Yatao Bian, Yu Rong, Jia Li",Yifan Niu,English,"Molecular optimization, a critical research area in drug discovery, aims to enhance the properties or performance of molecules through systematic modifications of their chemical structures. Recently, existing Multi-Objective Molecular Optimization (MOMO) methods are extended from Single-Objective Molecular Optimization (SOMO) approaches by employing techniques such as Linear Scalarization, Evolutionary Algorithms, and Multi-Objective Bayesian Optimization. In Multi-Objective Optimization, the ideal goal is to find Pareto optimal solutions over different preferences, which indicate the importance of different objectives. However, these straightforward extensions often struggle with trading off multiple properties due to the conflicting or correlated nature of certain properties.  More specifically, current MOMO methods derived from SOMO are still challenged in finding preference-conditioned Pareto solutions and exhibit low efficiency in Pareto search. To address the aforementioned problems, we propose the \textbf{P}reference-\textbf{C}onditioned \textbf{I}nversion (PCI) framework,  efficiently ``inverting'' a pre-trained surrogate oracle under the guidance of a non-dominated gradient, to generate candidate Pareto optimal molecules over preference-conditioned distributions. Additionally, we provide theoretical guarantees for PCI's capability in converging to preference-conditioned solutions. This unique characteristic enables PCI to search the full Pareto front approximately, thereby assisting in the discovery of diverse molecules with varying ratios of properties. Comprehensive experimental evaluations show that our model significantly?…",Conference paper,https://openreview.net/forum?id=7ezBaMwOqY,0,niutrading,"Molecular Optimization,Preference-Conditioned Inversion"
2023,arXiv preprint arXiv:2310.07446,ProbTS: A Unified Toolkit to Probe Deep Time-series Forecasting,"Jiawen Zhang, Xumeng Wen, Shun Zheng, Jia Li, Jiang Bian",Jiawen Zhang,English,"Time-series forecasting serves as a linchpin in a myriad of applications, spanning various domains. With the growth of deep learning, this arena has bifurcated into two salient branches: one focuses on crafting specific neural architectures tailored for time series, and the other harnesses advanced deep generative models for probabilistic forecasting. While both branches have made significant progress, their differences across data scenarios, methodological focuses, and decoding schemes pose profound, yet unexplored, research questions. To bridge this knowledge chasm, we introduce ProbTS, a pioneering toolkit developed to synergize and compare these two distinct branches. Endowed with a unified data module, a modularized model module, and a comprehensive evaluator module, ProbTS allows us to revisit and benchmark leading methods from both branches. The scrutiny with ProbTS highlights their distinct characteristics, relative strengths and weaknesses, and areas that need further exploration. Our analyses point to new avenues for research, aiming for more effective time-series forecasting.",Article,https://arxiv.org/abs/2310.07446,0,zhang2023probts,time-series forecasting
2023,ICDE 2023,Decision Support System for Chronic Diseases Based on Drug-Drug Interactions,"Tian Bian, Yuli Jiang, Jia Li, Tingyang Xu, Yu Rong, Yi Su, Timothy Kwok, Helen Meng, Hong Cheng",Tian Bian,English,"Many patients with chronic diseases resort to multiple medications to relieve various symptoms, which raises concerns about the safety of multiple medication use, as severe drug-drug antagonism can lead to serious adverse effects or even death. This paper presents a Decision Support System, called DSSDDI, based on drug-drug interactions to support doctors prescribing decisions. DSSDDI contains three modules, Drug-Drug Interaction (DDI) module, Medical Decision (MD) module and Medical Support (MS) module. The DDI module learns safer and more effective drug representations from the drug-drug interactions. To capture the potential causal relationship between DDI and medication use, the MD module considers the representations of patients and drugs as context, DDI and patients’ similarity as treatment, and medication use as outcome to construct counterfactual links for the representation learning?…",Article,https://ieeexplore.ieee.org/abstract/document/10184846/,0,bian2023decision,"Decision Support System, Drug-Drug Interactions, Causal Inference"
2022,US Patent 11,"Network communication method and system, device, and storage medium","Zhihao Shang, Jia Li, Huanxin Liu, Hongfei Zhou",Zhihao Shang,English,"This application discloses a network communication method applied to a network communication system including a first network device in a first private network, a second network device in a second private network and a gateway device coupling the first private network to the second private network. The first network device receives a first data packet transmitted from a terminal to a target blockchain node, and acquires an actual network address of the target blockchain node; and generates a second data packet according to the first data packet and the actual network address, and transmits the second data packet to a virtual network address of the second network device in the second private network, so that the operation overheads generated when the gateway device generates virtual network addresses for blockchain nodes can be reduced, thereby saving a storage space of the gateway device.",Conference paper,https://patents.google.com/patent/US11271892B2/en,11,shang2022network,"graph denoising, graph clustering, graph autoencoder"
