Year,Sources,Name,Authors,First Author,Chinese/English,Abstract,Venues,doi,Citation,Id,Keywords
2023,arXiv preprint arXiv:2302.09302,Bridge the gap between language models and tabular understanding,"Nuo Chen, Linjun Shou, Ming Gong, Jian Pei, Chenyu You, Jianhui Chang, Daxin Jiang, Jia Li",Nuo Chen,English,"Table pretrain-then-finetune paradigm has been proposed and employed at a rapid pace after the success of pre-training in the natural language domain. Despite the promising findings in tabular pre-trained language models (TPLMs), there is an input gap between pre-training and fine-tuning phases. For instance, TPLMs jointly pre-trained with table and text input could be effective for tasks also with table-text joint input like table question answering, but it may fail for tasks with only tables or text as input such as table retrieval. To this end, we propose UTP, an approach that dynamically supports three types of multi-modal inputs: table-text, table, and text. Specifically, UTP is pre-trained with two strategies: (1) We first utilize a universal mask language modeling objective on each kind of input, enforcing the model to adapt various inputs. (2) We then present Cross-Modal Contrastive Regularization (CMCR), which utilizes contrastive learning to encourage the consistency between table-text cross-modality representations via unsupervised instance-wise training signals during pre-training. By these means, the resulting model not only bridges the input gap between pre-training and fine-tuning but also advances in the alignment of table and text. Extensive results show UTP achieves superior results on uni-modal input tasks (e.g., table retrieval) and cross-modal input tasks (e.g., table question answering).",Article,https://arxiv.org/abs/2302.09302,3,chen2023bridge,"pre-trained language models,tabular understanding"
2024,arXiv preprint arXiv:2402.11975,Compress to Impress: Unleashing the Potential of Compressive Memory in Real-World Long-Term Conversations,"Nuo Chen, Hongguang Li, Juhua Huang, Baoyuan Wang, Jia Li",Nuo Chen,English,"Existing retrieval-based methods have made significant strides in maintaining long-term conversations. However, these approaches face challenges in memory database management and accurate memory retrieval, hindering their efficacy in dynamic, real-world interactions. This study introduces a novel framework, COmpressive Memory-Enhanced Dialogue sYstems (COMEDY), which eschews traditional retrieval modules and memory databases. Instead, COMEDY adopts a ''One-for-All'' approach, utilizing a single language model to manage memory generation, compression, and response generation. Central to this framework is the concept of compressive memory, which intergrates session-specific summaries, user-bot dynamics, and past events into a concise memory format. To support COMEDY, we curated a large-scale Chinese instruction-tuning dataset, Dolphin, derived from real user-chatbot interactions. Comparative evaluations demonstrate COMEDY's superiority over traditional retrieval-based methods in producing more nuanced and human-like conversational experiences. Our codes are available at https://github.com/nuochenpku/COMEDY.",Article,https://arxiv.org/abs/2402.11975,2,chen2024compress,"retrieval-based,long-term conversations"
2023,Findings of the Association for Computational Linguistics: ACL 2023,Structural Contrastive Pretraining for Cross-Lingual Comprehension,"Nuo Chen, Linjun Shou, Tengtao Song, Ming Gong, Jian Pei, Jianhui Chang, Daxin Jiang, Jia Li",Nuo Chen,English,"To present, multilingual language models trained using various pre-training tasks like mask language modeling (MLM) have yielded encouraging results on a wide range of downstream tasks. Despite the promising performances, structural knowledge in cross-lingual corpus is less explored in current works, leading to the semantic misalignment. In this paper, we propose a new pre-training task named Structural Contrast Pretraining (SCP) to align the structural words in a parallel sentence, enhancing the models’ ability to comprehend cross-lingual representations. Concretely, each structural word in source and target languages is regarded as a positive pair in SCP. Since contrastive learning compares positive and negative pairs, an increase in the frequency of negative pairings could enhance the performance of the resulting model. Therefore, we further propose Cross-lingual Momentum Contrast (CL-MoCo) to increase the number of negative pairs by maintaining a large size of the queue. CL-MoCo extends the original Moco approach into cross-lingual training and jointly optimizes the source-to-target language and target-to-source language representations, resulting in a more suitable encoder for cross-lingual transfer. We conduct extensive experiments to validate the proposed approach on three cross-lingual tasks across five datasets such as MLQA, WikiAnn, etc, and results prove the effectiveness of our method.",Conference paper,https://aclanthology.org/2023.findings-acl.128/,2,chen2023structural,Structural Contrast Pretraining
2024,arXiv preprint arXiv:2405.02358,A Survey of Time Series Foundation Models: Generalizing Time Series Representation with Large Language Mode,"Jiexia Ye, Weiqi Zhang, Ke Yi, Yongzi Yu, Ziyue Li, Jia Li, Fugee Tsung",Jiexia Ye,English,"Time series data are ubiquitous across various domains, making time series analysis critically important. Traditional time series models are task-specific, featuring singular functionality and limited generalization capacity. Recently, large language foundation models have unveiled their remarkable capabilities for cross-task transferability, zero-shot/few-shot learning, and decision-making explainability. This success has sparked interest in the exploration of foundation models to solve multiple time series challenges simultaneously. There are two main research lines, namely \textbf{pre-training foundation models from scratch for time series} and \textbf{adapting large language foundation models for time series}. They both contribute to the development of a unified model that is highly generalizable, versatile, and comprehensible for time series analysis. This survey offers a 3E analytical framework for comprehensive examination of related research. Specifically, we examine existing works from three dimensions, namely \textbf{Effectiveness}, \textbf{Efficiency} and \textbf{Explainability}. In each dimension, we focus on discussing how related works devise tailored solution by considering unique challenges in the realm of time series.Furthermore, we provide a domain taxonomy to help followers keep up with the domain-specific advancements. In addition, we introduce extensive resources to facilitate the field's development, including datasets, open-source, time series libraries. A GitHub repository is also maintained for resource updates (https://github.com/start2020/Awesome-TimeSeries-LLM-FM).",Article,https://arxiv.org/abs/2405.02358,1,ye2024survey,"time series,large language models"
2024,arXiv preprint arXiv:2405.02299,Deep Reinforcement Learning for Modelling Protein Complexes,"Tao Feng, Ziqi Gao, Jiaxuan You, Chenyi Zi, Yan Zhou, Chen Zhang, Jia Li",Tao Feng,English,"AlphaFold can be used for both single-chain and multi-chain protein structure prediction, while the latter becomes extremely challenging as the number of chains increases. In this work, by taking each chain as a node and assembly actions as edges, we show that an acyclic undirected connected graph can be used to predict the structure of multi-chain protein complexes (a.k.a., protein complex modelling, PCM). However, there are still two challenges: 1) The huge combinatorial optimization space of  ( is the number of chains) for the PCM problem can easily lead to high computational cost. 2) The scales of protein complexes exhibit distribution shift due to variance in chain numbers, which calls for the generalization in modelling complexes of various scales. To address these challenges, we propose GAPN, a Generative Adversarial Policy Network powered by domain-specific rewards and adversarial loss through policy gradient for automatic PCM prediction. Specifically, GAPN learns to efficiently search through the immense assembly space and optimize the direct docking reward through policy gradient. Importantly, we design an adversarial reward function to enhance the receptive field of our model. In this way, GAPN will simultaneously focus on a specific batch of complexes and the global assembly rules learned from complexes with varied chain numbers. Empirically, we have achieved both significant accuracy (measured by RMSD and TM-Score) and efficiency improvements compared to leading PCM softwares. GAPN outperforms the state-of-the-art method (MoLPC) with up to 27% improvement in TM-Score, with a speed-up of 600?…",Article,https://arxiv.org/abs/2405.02299,1,feng2024deep,"Generative Adversarial Policy Network,reinforcement learning"
2024,arXiv preprint arXiv:2402.16029,GraphWiz: An Instruction-Following Language Model for Graph Problems,"Nuo Chen, Yuhan Li, Jianheng Tang, Jia Li",Nuo Chen,English,"Large language models (LLMs) have achieved impressive success across several fields, but their proficiency in understanding and resolving complex graph problems is less explored. To bridge this gap, we introduce GraphInstruct, a novel and comprehensive instruction-tuning dataset designed to equip language models with the ability to tackle a broad spectrum of graph problems using explicit reasoning paths. Utilizing GraphInstruct, we build GraphWiz, an open-source language model capable of resolving various graph problem types while generating clear reasoning processes. To enhance the model's capability and reliability, we incorporate the Direct Preference Optimization (DPO) framework into the graph problem-solving context. The enhanced model, GraphWiz-DPO, achieves an average accuracy of 65% across nine tasks with different complexity levels, surpassing GPT-4 which has an average accuracy of 43.8%. Moreover, our research delves into the delicate balance between training data volume and model performance, highlighting the potential for overfitting with increased data. We also explore the transferability of the model's reasoning ability across different graph tasks, indicating the model's adaptability and practical application potential. Our investigation offers a new blueprint and valuable insights for developing LLMs specialized in graph reasoning and problem-solving.",Article,https://arxiv.org/abs/2402.16029,1,chen2024graphwiz,"graph algorithms, large language models, instruction tuning"
2023,arXiv preprint arXiv:2401.05384,From good to great: Improving math reasoning with tool-augmented interleaf prompting,"Nuo Chen, Hongguang Li, Baoyuan Wang, Jia Li",Nuo Chen,English,"This paper investigates the performance of Large Language Models (LLMs) and Tool-augmented LLMs in tackling complex mathematical reasoning tasks. We introduce IMP-TIP: Improving Math Reasoning with Tool-augmented Interleaf Prompting, a framework that combines the strengths of both LLMs and Tool-augmented LLMs. IMP-TIP follows the ``From Good to Great"" concept, collecting multiple potential solutions from both LLMs and their Tool-Augmented counterparts for the same math problem, and then selecting or re-generating the most accurate answer after cross-checking these solutions via tool-augmented interleaf prompting. The framework incorporates two key aspects: self-prompt and tool-augmented interleaf prompting (TIP). The former allows LLMs to autonomously refine and improve an initial prompt related to tool usage, while the latter enables LLMs to derive the final answer by dynamically analyzing the problem, cross-checking potential solutions, and revising previous reasoning hints in an interleaved manner. Experimental analysis shows that IMP-TIP achieves enhanced mathematical capabilities and outperforms traditional LLMs and tool-augmented LLMs in accuracy and reasoning diversity on math reasoning tasks. For instance, IMP-TIP can improve Tool-augmented ChatGPT on GSM8K-Hard from 56.0% to 65.2%.",Article,https://arxiv.org/abs/2401.05384,1,chen2023good,"large language models,tool augmented interleaf prompting"
2023,arXiv preprint arXiv:2312.04333,Beyond Surface: Probing LLaMA Across Scales and Layers,"Nuo Chen, Ning Wu, Shining Liang, Ming Gong, Linjun Shou, Dongmei Zhang, Jia Li",Nuo Chen,English,"This paper presents an in-depth analysis of Large Language Models (LLMs), focusing on LLaMA, a prominent open-source foundational model in natural language processing. Instead of assessing LLaMA through its generative output, we design multiple-choice tasks to probe its intrinsic understanding in high-order tasks such as reasoning and computation. We examine the model horizontally, comparing different sizes, and vertically, assessing different layers. We unveil several key and uncommon findings based on the designed probing tasks: (1) Horizontally, enlarging model sizes almost could not automatically impart additional knowledge or computational prowess. Instead, it can enhance reasoning abilities, especially in math problem solving, and helps reduce hallucinations, but only beyond certain size thresholds; (2) In vertical analysis, the lower layers of LLaMA lack substantial arithmetic and factual knowledge, showcasing logical thinking, multilingual and recognitive abilities, with top layers housing most computational power and real-world knowledge.",Article,https://arxiv.org/abs/2312.04333,1,chen2023beyond,"large language models,LLaMA"
2023,arXiv preprint arXiv:2304.04474,Missing Data Imputation with Graph Laplacian Pyramid Network,"Weiqi Zhang, Guanlve Li, Jianheng Tang, Jia Li, Fugee Tsung",Weiqi Zhang,English,"Data imputation is a prevalent and important task due to the ubiquitousness of missing data. Many efforts try to first draft a completed data and second refine to derive the imputation results, or ""draft-then-refine"" for short. In this work, we analyze this widespread practice from the perspective of Dirichlet energy. We find that a rudimentary ""draft"" imputation will decrease the Dirichlet energy, thus an energy-maintenance ""refine"" step is in need to recover the overall energy. Since existing ""refine"" methods such as Graph Convolutional Network (GCN) tend to cause further energy decline, in this work, we propose a novel framework called Graph Laplacian Pyramid Network (GLPN) to preserve Dirichlet energy and improve imputation performance. GLPN consists of a U-shaped autoencoder and residual networks to capture global and local detailed information respectively. By extensive experiments on several real-world datasets, GLPN shows superior performance over state-of-the-art methods under three different missing mechanisms. Our source code is available at https://github.com/liguanlue/GLPN.",Article,https://arxiv.org/abs/2304.04474,1,zhang2023missing,"Missing Data, Dirichlet Energy, Graph Deep Learning"
2023,EMNLP Findings,Natural Response Generation for Chinese Reading Comprehension,"Nuo Chen, Hongguang Li, Yinan Bao, Baoyuan Wang, Jia Li",Nuo Chen,English,"Machine reading comprehension (MRC) is an important area of conversation agents and draws a lot of attention. However, there is a notable limitation to current MRC benchmarks: The labeled answers are mostly either spans extracted from the target corpus or the choices of the given candidates, ignoring the natural aspect of high-quality responses. As a result, MRC models trained on these datasets can not generate human-like responses in real QA scenarios. To this end, we construct a new dataset called Penguin to promote the research of MRC, providing a training and test bed for natural response generation to real scenarios. Concretely, Penguin consists of 200k training data with high-quality fluent, and well-informed responses. Penguin is the first benchmark towards natural response generation in Chinese MRC on a relatively large scale. To address the challenges in Penguin, we develop two strong baselines: end-to-end and two-stage frameworks. Following that, we further design Prompt-BART: fine-tuning the pre-trained generative language models with a mixture of prefix prompts in Penguin. Extensive experiments validated the effectiveness of this design.",Article,https://arxiv.org/abs/2302.08817,1,chen2023natural,machine reading comprehension
2024,arXiv preprint arXiv:2406.05346,ProG: A Graph Prompt Learning Benchmark,"Chenyi Zi, Haihong Zhao, Xiangguo Sun, Yiqing Lin, Hong Cheng, Jia Li",Chenyi Zi,English,"Artificial general intelligence on graphs has shown significant advancements across various applications, yet the traditional 'Pre-train & Fine-tune' paradigm faces inefficiencies and negative transfer issues, particularly in complex and few-shot settings. Graph prompt learning emerges as a promising alternative, leveraging lightweight prompts to manipulate data and fill the task gap by reformulating downstream tasks to the pretext. However, several critical challenges still remain: how to unify diverse graph prompt models, how to evaluate the quality of graph prompts, and to improve their usability for practical comparisons and selection. In response to these challenges, we introduce the first comprehensive benchmark for graph prompt learning. Our benchmark integrates SIX pre-training methods and FIVE state-of-the-art graph prompt techniques, evaluated across FIFTEEN diverse datasets to assess performance, flexibility, and efficiency. We also present 'ProG', an easy-to-use open-source library that streamlines the execution of various graph prompt models, facilitating objective evaluations. Additionally, we propose a unified framework that categorizes existing graph prompt methods into two main approaches: prompts as graphs and prompts as tokens. This framework enhances the applicability and comparison of graph prompt techniques. The code is available at: https://github.com/sheldonresearch/ProG.",Article,https://arxiv.org/abs/2406.05346,0,zi2024prog,"graph prompt learning,fine-tuning"
2024,arXiv e-prints,DualTime: A Dual-Adapter Multimodal Language Model for Time Series Representation,"Weiqi Zhang, Jiexia Ye, Ziyue Li, Jia Li, Fugee Tsung",Weiqi Zhang,English,"The recent rapid development of language models (LMs) has attracted attention in the field of time series, including multimodal time series modeling. However, we note that current time series multimodal methods are biased, often assigning a primary role to one modality while the other assumes a secondary role. They overlook the mutual benefits and complementary of different modalities. For example, in seizure diagnosis, relying solely on textual clinical reports makes it difficult to pinpoint the area and type of the disease, while electroencephalograms (EEGs) alone cannot provide an accurate diagnosis without considering the symptoms. In this study, based on the complementary information mining of time series multimodal data, we propose DualTime, a Dual-adapter multimodal language model for Time series representation implementing temporal-primary and textual-primary modeling simultaneously. By injecting lightweight adaption tokens, the LM pipeline shared by dual adapters encourages embedding alignment and achieves efficient fine-tuning. Empirically, our method outperforms state-of-the-art models in both supervised and unsupervised settings, highlighting the complementary benefits of different modalities. In addition, we conduct few-shot label transfer experiments, which further verifies the transferability and expressiveness of our proposed DualTime.",Article,https://arxiv.org/pdf/2406.06620,0,zhang2024dualtime,"dual-adapter,multimodal language model"
2024,arXiv preprint arXiv:2405.20202,One QuantLLM for ALL: Fine-tuning Quantized LLMs Once for Efficient Deployments,"Ke Yi, Yuhui Xu, Heng Chang, Chen Tang, Yuan Meng, Tong Zhang, Jia Li",Ke Yi,English,"Large Language Models (LLMs) have advanced rapidly but face significant memory demands. While quantization has shown promise for LLMs, current methods typically require lengthy training to alleviate the performance degradation from quantization loss. However, deploying LLMs across diverse scenarios with different resource constraints, e.g., servers and personal computers, requires repeated training per application, which amplifies the lengthy training problem. Given that, it is advantageous to train a once-for-all (OFA) supernet capable of yielding diverse optimal subnets for downstream applications through one-shot training. Nonetheless, the scale of current language models impedes efficiency and amplifies interference from weight sharing between subnets. We make an initial attempt to extend the once-for-all framework to large language models. Specifically, we decouple shared weights to eliminate the interference and incorporate Low-Rank adapters for training efficiency. Furthermore, we observe the imbalance allocation of training resources from the traditional uniform sampling. A non-parametric scheduler is introduced to adjust the sampling rate for each quantization configuration, achieving a more balanced allocation among subnets with varying demands. We validate the approach on LLaMA2 families, and downstream evaluation confirms our ability to maintain high performance while significantly reducing deployment time faced with multiple scenarios.",Article,https://arxiv.org/abs/2405.20202,0,yi2024one,"large language models,once-for-all,LLaMA"
2024,Proceedings of the ACM on Web Conference 2024,Weakly Supervised Anomaly Detection via Knowledge-Data Alignment,"Haihong Zhao, Chenyi Zi, Yang Liu, Chen Zhang, Yan Zhou, Jia Li",Haihong Zhao,English,"Anomaly detection (AD) plays a pivotal role in numerous web-based applications, including malware detection, anti-money laundering, device failure detection, and network fault analysis. Most methods, which rely on unsupervised learning, are hard to reach satisfactory detection accuracy due to the lack of labels. Weakly Supervised Anomaly Detection (WSAD) has been introduced with a limited number of labeled anomaly samples to enhance model performance. Nevertheless, it is still challenging for models, trained on an inadequate amount of labeled data, to generalize to unseen anomalies. In this paper, we introduce a novel framework Knowledge-Data Alignment (KDAlign) to integrate rule knowledge, typically summarized by human experts, to supplement the limited labeled data. Specifically, we transpose these rules into the knowledge space and subsequently recast the incorporation of knowledge as the alignment of knowledge and data. To facilitate this alignment, we employ the Optimal Transport (OT) technique. We then incorporate the OT distance as an additional loss term to the original objective function of WSAD methodologies. Comprehensive experimental results on five real-world datasets demonstrate that our proposed KDAlign framework markedly surpasses its state-of-the-art counterparts, achieving superior performance across various anomaly types.",Conference paper,https://arxiv.org/abs/2402.03785,0,zhao2024weakly,"Weakly Supervised Anomaly Detection,anomaly detection"
2024,arXiv preprint arXiv:2405.03003,Parameter-Efficient Fine-Tuning with Discrete Fourier Transform,"Ziqi Gao, Qichao Wang, Aochuan Chen, Zijing Liu, Bingzhe Wu, Liang Chen, Jia Li",Ziqi Gao,English,"Low-rank adaptation~(LoRA) has recently gained much interest in fine-tuning foundation models. It effectively reduces the number of trainable parameters by incorporating low-rank matrices  and  to represent the weight change, i.e., . Despite LoRA's progress, it faces storage challenges when handling extensive customization adaptations or larger base models. In this work, we aim to further compress trainable parameters by enjoying the powerful expressiveness of the Fourier transform. Specifically, we introduce FourierFT, which treats  as a matrix in the spatial domain and learns only a small fraction of its spectral coefficients. With the trained spectral coefficients, we implement the inverse discrete Fourier transform to recover . Empirically, our FourierFT method shows comparable or better performance with fewer parameters than LoRA on various tasks, including natural language understanding, natural language generation, instruction tuning, and image classification. For example, when performing instruction tuning on the LLaMA2-7B model, FourierFT surpasses LoRA with only 0.064M trainable parameters, compared to LoRA's 33.5M. Our code is released at \url{https://github.com/Chaos96/fourierft}.",Article,https://arxiv.org/abs/2405.03003,0,gao2024parameter,"low-rank adaptation,fine-tuning, LLaMA"
