Year,Sources,Name,Authors,First Author,Chinese/English,Abstract,Venues,doi,Citation,Id,Keywords
2023,WWW 2023,Knowledge Graph Completion with Counterfactual Augmentation,"Heng Chang, Jie Cai, Jia Li",Heng Chang,English," Graph Neural Networks (GNNs) have demonstrated great success in Knowledge Graph Completion (KGC) by modeling how entities and relations interact in recent years. However, most of them are designed to learn from the observed graph structure, which appears to have imbalanced relation distribution during the training stage. Motivated by the causal relationship among the entities on a knowledge graph, we explore this defect through a counterfactual question: “would the relation still exist if the neighborhood of entities became different from observation?”. With a carefully designed instantiation of a causal model on the knowledge graph, we generate the counterfactual relations to answer the question by regarding the representations of entity pair given relation as context, structural information of relation-aware neighborhood as treatment, and validity of the composed triplet as the outcome. Furthermore, we?…",Article,https://dl.acm.org/doi/abs/10.1145/3543507.3583401,9,chang2023knowledge,"causal inference, knowledge graph completion, graph augmentation, graph neural networks"
2021,US Patent US 2019/0355147 A1,"Method and apparatus for determining object posture in image, device, and storage medium",Jia Li,Jia Li,English,"This application discloses a method and an apparatus for determining a posture of a target object in an image, a device, and a non-transitory storage medium. In the method, a training model parameter of a convolutional neural network of the target object is obtained from a server. A real-time image of the target object is obtained. At least one first image block from the real-time image is identified. The at least one first image block is a local image of the real-time image. According to the training model parameter, a label image block matching the at least one first image block is determined. The label image block is a local image of a standard image of the target object. Furthermore, the posture of the target object is determined, by processing circuitry of a terminal device, according to the at least one first image block and the determined label image block.",Conference paper,https://patents.google.com/patent/US11107232B2/en,9,li2021method,None
2021,Proceedings of the Web Conference 2021,Mask-gvae: Blind denoising graphs via partition,"Jia Li, Mengzhou Liu, Honglei Zhang, Pengyun Wang, Yong Wen, Lujia Pan, Hong Cheng",Jia Li,English," We present Mask-GVAE, a variational generative model for blind denoising large discrete graphs, in which ”blind denoising” means we don’t require any supervision from clean graphs. We focus on recovering graph structures via deleting irrelevant edges and adding missing edges, which has many applications in real-world scenarios, for example, enhancing the quality of connections in a co-authorship network. Mask-GVAE makes use of the robustness in low eigenvectors of graph Laplacian against random noise and decomposes the input graph into several stable clusters. It then harnesses the huge computations by decoding probabilistic smoothed subgraphs in a variational manner. On a wide variety of benchmarks, Mask-GVAE outperforms competing approaches by a significant margin on PSNR and WL similarity. ",Conference paper,https://dl.acm.org/doi/abs/10.1145/3442381.3449899,9,li2021mask,"graph denoising, graph clustering, graph autoencoder"
2020,arXiv preprint arXiv:2012.11898,Graph autoencoders with deconvolutional networks,"Jia Li, Tomas Yu, Da-Cheng Juan, Arjun Gopalan, Hong Cheng, Andrew Tomkins",Jia Li,English,"Recent studies have indicated that Graph Convolutional Networks (GCNs) act as a \emph{low pass} filter in spectral domain and encode smoothed node representations. In this paper, we consider their opposite, namely Graph Deconvolutional Networks (GDNs) that reconstruct graph signals from smoothed node representations. We motivate the design of Graph Deconvolutional Networks via a combination of inverse filters in spectral domain and de-noising layers in wavelet domain, as the inverse operation results in a \emph{high pass} filter and may amplify the noise. Based on the proposed GDN, we further propose a graph autoencoder framework that first encodes smoothed graph representations with GCN and then decodes accurate graph signals with GDN. We demonstrate the effectiveness of the proposed method on several tasks including unsupervised graph-level representation , social recommendation and graph generation",Article,https://arxiv.org/abs/2012.11898,9,li2020graph,"graph convolutional networks,graph deconvolutional networks"
2023,ACL 2023 Findings,A Fused Gromov-Wasserstein Framework for Unsupervised Knowledge Graph Entity Alignment,"Jianheng Tang, Kangfei Zhao, Jia Li",Jianheng Tang,English,"Entity alignment is the task of identifying corresponding entities across different knowledge graphs (KGs). Although recent embedding-based entity alignment methods have shown significant advancements, they still struggle to fully utilize KG structural information. In this paper, we introduce FGWEA, an unsupervised entity alignment framework that leverages the Fused Gromov-Wasserstein (FGW) distance, allowing for a comprehensive comparison of entity semantics and KG structures within a joint optimization framework. To address the computational challenges associated with optimizing FGW, we devise a three-stage progressive optimization algorithm. It starts with a basic semantic embedding matching, proceeds to approximate cross-KG structural and relational similarity matching based on iterative updates of high-confidence entity links, and ultimately culminates in a global structural comparison between KGs. We perform extensive experiments on four entity alignment datasets covering 14 distinct KGs across five languages. Without any supervision or hyper-parameter tuning, FGWEA surpasses 21 competitive baselines, including cutting-edge supervised entity alignment methods. Our code is available at https://github.com/squareRoot3/FusedGW-Entity-Alignment.",Article,https://arxiv.org/abs/2305.06574,9,tang2023fused,"Fused Gromov-Wasserstein,knowledge graph"
2023,CIKM,A Co-training Approach for Noisy Time Series Learning,"Weiqi Zhang, Jianfeng Zhang, Jia Li, Fugee Tsung",Weiqi Zhang,English,"In this work, we focus on robust time series representation learning. Our assumption is that real-world time series is noisy and complementary information from different views of the same time series plays an important role while analyzing noisy input. Based on this, we create two views for the input time series through two different encoders. We conduct co-training based contrastive learning iteratively to learn the encoders. Our experiments demonstrate that this co-training approach leads to a significant improvement in performance. Especially, by leveraging the complementary information from different views, our proposed TS-CoT method can mitigate the impact of data noise and corruption. Empirical evaluations on four time series benchmarks in unsupervised and semi-supervised settings reveal that TS-CoT outperforms existing methods. Furthermore, the representations learned by TS-CoT can transfer well to?…",Article,https://dl.acm.org/doi/abs/10.1145/3583780.3614759,7,zhang2023co,"Bregman Alternating Projected Gradient,Gromov-Wasserstein"
2023,KDD 2023,Warpformer: A Multi-scale Modeling Approach for Irregular Clinical Time Series,"Jiawen Zhang, Shun Zheng, Wei Cao, Jiang Bian, Jia Li",Jiawen Zhang,English,"Irregularly sampled multivariate time series are ubiquitous in various fields, particularly in healthcare, and exhibit two key characteristics: intra-series irregularity and inter-series discrepancy. Intra-series irregularity refers to the fact that time-series signals are often recorded at irregular intervals, while inter-series discrepancy refers to the significant variability in sampling rates among diverse series. However, recent advances in irregular time series have primarily focused on addressing intra-series irregularity, overlooking the issue of inter-series discrepancy. To bridge this gap, we present Warpformer, a novel approach that fully considers these two characteristics. In a nutshell, Warpformer has several crucial designs, including a specific input representation that explicitly characterizes both intra-series irregularity and inter-series discrepancy, a warping module that adaptively unifies irregular time series in a given?…",Article,https://dl.acm.org/doi/abs/10.1145/3580305.3599543,7,zhang2023warpformer,"clinical time series, irregularly sampled time series, multi-scale representation"
2023,EMNLP Findings,Orca: A Few-shot Benchmark for Chinese Conversational Machine Reading Comprehension,"Nuo Chen, Hongguang Li, Yinan Bao, Junqing He, Xinshi Lin, Qi Yang, Jianfeng Liu, Ruyi Gan, Jiaxing Zhang, Baoyuan Wang, Jia Li",Nuo Chen,English,"The conversational machine reading comprehension (CMRC) task aims to answer questions in conversations, which has been a hot research topic in recent years because of its wide applications. However, existing CMRC benchmarks in which each conversation is assigned a static passage are inconsistent with real scenarios. Thus, model's comprehension ability towards real scenarios are hard to evaluate reasonably. To this end, we propose the first Chinese CMRC benchmark Orca and further provide zero-shot/few-shot settings to evaluate model's generalization ability towards diverse domains. We collect 831 hot-topic driven conversations with 4,742 turns in total. Each turn of a conversation is assigned with a response-related passage, aiming to evaluate model's comprehension ability more reasonably. The topics of conversations are collected from social media platform and cover 33 domains, trying to be consistent with real scenarios. Importantly, answers in Orca are all well-annotated natural responses rather than the specific spans or short phrase in previous datasets. Besides, we implement three strong baselines to tackle the challenge in Orca. The results indicate the great challenge of our CMRC benchmark. Our datatset and checkpoints are available at https://github.com/nuochenpku/Orca.",Article,https://arxiv.org/abs/2302.13619,6,chen2023orca,Chinese machine reading comprehension
2023,The Twelfth International Conference on Learning Representations,Improving generalization in equivariant graph neural networks with physical inductive biases,"Yang Liu, Jiashun Cheng, Haihong Zhao, Tingyang Xu, Peilin Zhao, Fugee Tsung, Jia Li, Yu Rong",Yang Liu,English,"Graph Neural Networks (GNNs) with equivariant properties have emerged as powerful tools for modeling complex dynamics of multi-object physical systems. However, their generalization ability is limited by the inadequate consideration of physical inductive biases: (1) Existing studies overlook the continuity of transitions among system states, opting to employ several discrete transformation layers to learn the direct mapping between two adjacent states; (2) Most models only account for first-order velocity information, despite the fact that many physical systems are governed by second-order motion laws. To incorporate these inductive biases, we propose the Second-order Equivariant Graph Neural Ordinary Differential Equation (SEGNO). Specifically, we show how the second-order continuity can be incorporated into GNNs while maintaining the equivariant property. Furthermore, we offer theoretical insights into SEGNO, highlighting that it can learn a unique trajectory between adjacent states, which is crucial for model generalization. Additionally, we prove that the discrepancy between this learned trajectory of SEGNO and the true trajectory is bounded. Extensive experiments on complex dynamical systems including molecular dynamics and motion capture demonstrate that our model yields a significant improvement over the state-of-the-art baselines.",Conference paper,https://openreview.net/forum?id=3oTPsORaDH,4,liu2024improving,equivariant graph neural networks
2023,WSDM 2024,GAD-NR: Graph Anomaly Detection via Neighborhood Reconstruction,"Amit Roy, Juan Shu, Jia Li, Carl Yang, Olivier Elshocht, Jeroen Smeets, Pan Li",Amit Roy,English,"Graph Anomaly Detection (GAD) is a technique used to identify abnormal nodes within graphs, finding applications in network security, fraud detection, social media spam detection, and various other domains. A common method for GAD is Graph Auto-Encoders (GAEs), which encode graph data into node representations and identify anomalies by assessing the reconstruction quality of the graphs based on these representations. However, existing GAE models are primarily optimized for direct link reconstruction, resulting in nodes connected in the graph being clustered in the latent space. As a result, they excel at detecting cluster-type structural anomalies but struggle with more complex structural anomalies that do not conform to clusters. To address this limitation, we propose a novel solution called GAD-NR, a new variant of GAE that incorporates neighborhood reconstruction for graph anomaly detection. GAD-NR aims to reconstruct the entire neighborhood of a node, encompassing the local structure, self-attributes, and neighbor attributes, based on the corresponding node representation. By comparing the neighborhood reconstruction loss between anomalous nodes and normal nodes, GAD-NR can effectively detect any anomalies. Extensive experimentation conducted on six real-world datasets validates the effectiveness of GAD-NR, showcasing significant improvements (by up to 30% in AUC) over state-of-the-art competitors. The source code for GAD-NR is openly available. Importantly, the comparative analysis reveals that the existing methods perform well only in detecting one or two types of anomalies out of the three types studied. In?…",Article,https://arxiv.org/abs/2306.01951,5,roy2024gad,"Anomaly Detection, graph neural networks, Auto-Encoder"
2022,AAAI 2023,Human Mobility Modeling During the COVID-19 Pandemic via Deep Graph Diffusion Infomax,"Yang Liu, Yu Rong, Zhuoning Guo, Nuo Chen, Tingyang Xu, Fugee Tsung, Jia Li",Yang Liu,English,"Non-Pharmaceutical Interventions (NPIs), such as social gathering restrictions, have shown effectiveness to slow the transmission of COVID-19 by reducing the contact of people. To support policy-makers, multiple studies have first modelled human mobility via macro indicators (eg, average daily travel distance) and then study the effectiveness of NPIs. In this work, we focus on mobility modelling and, from a micro perspective, aim to predict locations that will be visited by COVID-19 cases. Since NPIs generally cause economic and societal loss, such a prediction benefits governments when they design and evaluate them. However, in real-world situations, strict privacy data protection regulations result in severe data sparsity problems (ie, limited case and location information). To address these challenges and jointly model variables including a geometric graph, a set of diffusions and a set of locations, we propose a model named Deep Graph Diffusion Infomax (DGDI). We show the maximization of DGDI can be bounded by two tractable components: a univariate Mutual Information (MI) between geometric graph and diffusion representation, and a univariate MI between diffusion representation and location representation. To facilitate the research of COVID-19 prediction, we present two benchmarks that contain geometric graphs and location histories of COVID-19 cases. Extensive experiments on the two benchmarks show that DGDI significantly outperforms other competing methods.",Article,https://ojs.aaai.org/index.php/AAAI/article/view/26678,5,liu2023human,"Non-Pharmaceutical Interventions,Deep Graph Diffusion Infomax"
2022,arXiv preprint arXiv:2209.07921,Imdrug: A benchmark for deep imbalanced learning in ai-aided drug discovery,"Lanqing Li, Liang Zeng, Ziqi Gao, Shen Yuan, Yatao Bian, Bingzhe Wu, Hengtong Zhang, Yang Yu, Chan Lu, Zhipeng Zhou, Hongteng Xu, Jia Li, Peilin Zhao, Pheng-Ann Heng",Lanqing Li,English,"The last decade has witnessed a prosperous development of computational methods and dataset curation for AI-aided drug discovery (AIDD). However, real-world pharmaceutical datasets often exhibit highly imbalanced distribution, which is overlooked by the current literature but may severely compromise the fairness and generalization of machine learning applications. Motivated by this observation, we introduce ImDrug, a comprehensive benchmark with an open-source Python library which consists of 4 imbalance settings, 11 AI-ready datasets, 54 learning tasks and 16 baseline algorithms tailored for imbalanced learning. It provides an accessible and customizable testbed for problems and solutions spanning a broad spectrum of the drug discovery pipeline such as molecular modeling, drug-target interaction and retrosynthesis. We conduct extensive empirical studies with novel evaluation metrics, to demonstrate that the existing algorithms fall short of solving medicinal and pharmaceutical challenges in the data imbalance scenario. We believe that ImDrug opens up avenues for future research and development, on real-world challenges at the intersection of AIDD and deep imbalanced learning.",Article,https://arxiv.org/abs/2209.07921,5,li2022imdrug,"Imbalanced Learning, Long-tailed Learning, AI for Drug Discovery, Deep Learning Benchmark"
2020,US Patent 10,"Method, device and system for sharing cross-platform account resources","Hongfei Zhou, Jia Li",Hongfei Zhou,English,"A method for sharing a cross-platform account resource is described. An authentication request carrying a user name, a password, and an ID of an APP resource server is transmitted to an account management server, based on a register account on the account management server; an authentication ticket corresponding to the APP resource server is received from the account managements server, and the authentication ticket is stored, in which the authentication ticket carries a user ID, an authorization key and a refresh key; a resource request is transmitted to the APP resource server, based on the user ID and the authorization key in the authentication ticket; an APP resource is received from the APP resource server, after the APP resource server requests the account management server to verify the authentication ticket by using the user ID and the authorization key.",Conference paper,https://patents.google.com/patent/US10586027B2/en,5,zhou2020method,"causal inference, knowledge graph completion, graph augmentation, graph neural networks"
2024,arXiv preprint arXiv:2402.18813,Protein Multimer Structure Prediction via Prompt Learning,"Ziqi Gao, Xiangguo Sun, Zijing Liu, Yu Li, Hong Cheng, Jia Li",Ziqi Gao,English,"Understanding the 3D structures of protein multimers is crucial, as they play a vital role in regulating various cellular processes. It has been empirically confirmed that the multimer structure prediction~(MSP) can be well handled in a step-wise assembly fashion using provided dimer structures and predicted protein-protein interactions~(PPIs). However, due to the biological gap in the formation of dimers and larger multimers, directly applying PPI prediction techniques can often cause a \textit{poor generalization} to the MSP task. To address this challenge, we aim to extend the PPI knowledge to multimers of different scales~(i.e., chain numbers). Specifically, we propose \textbf{\textsc{PromptMSP}}, a pre-training and \textbf{Prompt} tuning framework for \textbf{M}ultimer \textbf{S}tructure \textbf{P}rediction. First, we tailor the source and target tasks for effective PPI knowledge learning and efficient inference, respectively. We design PPI-inspired prompt learning to narrow the gaps of two task formats and generalize the PPI knowledge to multimers of different scales. We provide a meta-learning strategy to learn a reliable initialization of the prompt model, enabling our prompting framework to effectively adapt to limited data for large-scale multimers. Empirically, we achieve both significant accuracy (RMSD and TM-Score) and efficiency improvements compared to advanced MSP models. The code, data and checkpoints are released at \url{https://github.com/zqgao22/PromptMSP}.",Article,https://arxiv.org/abs/2402.18813,5,gao2024protein,"protein-protein interactions,prompt learning"
2024,arXiv preprint arXiv:2402.09834,All in One and One for All: A Simple yet Effective Method towards Cross-domain Graph Pretraining,"Haihong Zhao, Aochuan Chen, Xiangguo Sun, Hong Cheng, Jia Li",Haihong Zhao,English,"Large Language Models (LLMs) have revolutionized the fields of computer vision (CV) and natural language processing (NLP). One of the most notable advancements of LLMs is that a single model is trained on vast and diverse datasets spanning multiple domains -- a paradigm we term `All in One'. This methodology empowers LLMs with super generalization capabilities, facilitating an encompassing comprehension of varied data distributions. Leveraging these capabilities, a single LLM demonstrates remarkable versatility across a variety of domains -- a paradigm we term `One for All'. However, applying this idea to the graph field remains a formidable challenge, with cross-domain pretraining often resulting in negative transfer. This issue is particularly important in few-shot learning scenarios, where the paucity of training data necessitates the incorporation of external knowledge sources. In response to this challenge, we propose a novel approach called Graph COordinators for PrEtraining (GCOPE), that harnesses the underlying commonalities across diverse graph datasets to enhance few-shot learning. Our novel methodology involves a unification framework that amalgamates disparate graph datasets during the pretraining phase to distill and transfer meaningful knowledge to target tasks. Extensive experiments across multiple graph datasets demonstrate the superior efficacy of our approach. By successfully leveraging the synergistic potential of multiple graph datasets for pretraining, our work stands as a pioneering contribution to the realm of graph foundational model.",Article,https://arxiv.org/abs/2402.09834,6,zhao2024all,"pretraining, prompt tuning, graph neural networks"
2022,US Patent 11,"Data response method, terminal device, and server","LIU Feifei, Yong Yang, Meng Chen, JIA Yiwen, Fei You, WEN Binmin, Jia Li, ZONG Xuan, HAN Wuyu, YU Chuansheng, Wei Tian, CHEN Yuanbin, Yaohua Zhang",LIU Feifei,English,"Embodiments of the present disclosure disclose a data response method, a terminal device, and a server. The method in the embodiments of the present disclosure includes: sending encrypted information to a terminal device; receiving a first honeypot character, the encrypted information, and user data from the terminal device; decrypting the encrypted information, to obtain a second honeypot character comprised in the encrypted information; determining whether the first honeypot character sent by the terminal device is the same as the second honeypot character decrypted from the encrypted information; and responding to the user data in response to the first honeypot character being the same as the second honeypot character.",Conference paper,https://patents.google.com/patent/US11431684B2/en,1,feifei2022data,None
2023,NeurIPS 2023,Deep Insights into Noisy Pseudo Labeling on Graph Data,"Botao Wang, Jia Li, Yang Liu, Jiashun Cheng, Yu Rong, Wenjia Wang, Fugee Tsung",Botao Wang,English,"Pseudo labeling (PL) is a wide-applied strategy to enlarge the labeled dataset by self-annotating the potential samples during the training process. Several works have shown that it can improve the graph learning model performance in general. However, we notice that the incorrect labels can be fatal to the graph training process. Inappropriate PL may result in the performance degrading, especially on graph data where the noise can propagate. Surprisingly, the corresponding error is seldom theoretically analyzed in the literature. In this paper, we aim to give deep insights of PL on graph learning models. We first present the error analysis of PL strategy by showing that the error is bounded by the confidence of PL threshold and consistency of multi-view prediction. Then, we theoretically illustrate the effect of PL on convergence property. Based on the analysis, we propose a cautious pseudo labeling methodology in which we pseudo label the samples with highest confidence and multi-view consistency. Finally, extensive experiments demonstrate that the proposed strategy improves graph learning process and outperforms other PL strategies on link prediction and node classification tasks.",Article,https://proceedings.neurips.cc/paper_files/paper/2023/hash/f0318ba897cee71ce200e408dea6062e-Abstract-Conference.html,3,botao2023deep,pseudo labeling
